2018-08-30 11:13:49.453242 IP 192.168.1.5.50288 > 172.217.11.46.443: UDP, length 498
2018-08-30 11:13:49.454817 IP 192.168.1.5.50288 > 172.217.11.46.443: UDP, length 170
2018-08-30 11:13:49.491488 IP 192.168.1.5.50288 > 172.217.11.46.443: UDP, length 28
2018-08-30 11:13:49.582196 IP 192.168.1.5.50288 > 172.217.11.46.443: UDP, length 28
2018-08-30 11:13:49.582252 IP 192.168.1.5.50288 > 172.217.11.46.443: UDP, length 28
2018-08-30 11:13:49.582291 IP 192.168.1.5.50288 > 172.217.11.46.443: UDP, length 28
2018-08-30 11:13:49.582363 IP 192.168.1.5.50288 > 172.217.11.46.443: UDP, length 28
2018-08-30 11:13:49.586754 IP 192.168.1.5.50288 > 172.217.11.46.443: UDP, length 28
2018-08-30 11:13:49.606752 IP 192.168.1.5.50288 > 172.217.11.46.443: UDP, length 1350
2018-08-30 11:13:49.606805 IP 192.168.1.5.50288 > 172.217.11.46.443: UDP, length 261
2018-08-30 11:13:49.607969 IP 192.168.1.5.50288 > 172.217.11.46.443: UDP, length 39
2018-08-30 11:13:49.649558 IP 192.168.1.5.50288 > 172.217.11.46.443: UDP, length 28
2018-08-30 11:13:49.732414 IP 192.168.1.5.56822 > 167.206.252.143.443: UDP, length 1350
2018-08-30 11:13:49.732720 IP 192.168.1.5.56822 > 167.206.252.143.443: UDP, length 317
2018-08-30 11:13:49.732962 IP 192.168.1.5.56822 > 167.206.252.143.443: UDP, length 75
2018-08-30 11:13:49.749974 IP 192.168.1.5.56822 > 167.206.252.143.443: UDP, length 41
2018-08-30 11:13:49.750337 IP 192.168.1.5.56822 > 167.206.252.143.443: UDP, length 28
2018-08-30 11:13:49.751206 IP 192.168.1.5.56822 > 167.206.252.143.443: UDP, length 28
2018-08-30 11:13:49.778314 IP 192.168.1.5.52961 > 172.217.12.206.443: UDP, length 1350
2018-08-30 11:13:49.778528 IP 192.168.1.5.52961 > 172.217.12.206.443: UDP, length 338
2018-08-30 11:13:49.779435 IP 192.168.1.5.56822 > 167.206.252.143.443: UDP, length 28
2018-08-30 11:13:49.813178 IP 192.168.1.5.52961 > 172.217.12.206.443: UDP, length 1350
2018-08-30 11:13:49.813224 IP 192.168.1.5.52961 > 172.217.12.206.443: UDP, length 334
2018-08-30 11:13:49.835985 IP 192.168.1.5.50288 > 172.217.11.46.443: UDP, length 28
2018-08-30 11:13:49.836718 IP 192.168.1.5.50288 > 172.217.11.46.443: UDP, length 28
2018-08-30 11:13:49.836776 IP 192.168.1.5.50288 > 172.217.11.46.443: UDP, length 28
2018-08-30 11:13:49.836807 IP 192.168.1.5.50288 > 172.217.11.46.443: UDP, length 28
2018-08-30 11:13:49.838468 IP 192.168.1.5.50288 > 172.217.11.46.443: UDP, length 28
2018-08-30 11:13:49.840723 IP 192.168.1.5.50288 > 172.217.11.46.443: UDP, length 28
2018-08-30 11:13:49.847891 IP 192.168.1.5.50288 > 172.217.11.46.443: UDP, length 28
2018-08-30 11:13:49.848222 IP 192.168.1.5.52961 > 172.217.12.206.443: UDP, length 41
2018-08-30 11:13:49.848310 IP 192.168.1.5.52961 > 172.217.12.206.443: UDP, length 28
2018-08-30 11:13:49.870406 IP 192.168.1.5.52961 > 172.217.12.206.443: UDP, length 334
2018-08-30 11:13:49.876437 IP 192.168.1.5.50288 > 172.217.11.46.443: UDP, length 28
2018-08-30 11:13:49.885965 IP 192.168.1.5.52961 > 172.217.12.206.443: UDP, length 28
2018-08-30 11:13:49.886190 IP 192.168.1.5.52961 > 172.217.12.206.443: UDP, length 28
2018-08-30 11:13:49.886282 IP 192.168.1.5.52961 > 172.217.12.206.443: UDP, length 28
2018-08-30 11:13:49.886415 IP 192.168.1.5.52961 > 172.217.12.206.443: UDP, length 28
2018-08-30 11:13:49.888535 IP 192.168.1.5.52961 > 172.217.12.206.443: UDP, length 28
2018-08-30 11:13:49.888562 IP 192.168.1.5.52961 > 172.217.12.206.443: UDP, length 28
2018-08-30 11:13:49.888624 IP 192.168.1.5.52961 > 172.217.12.206.443: UDP, length 28
2018-08-30 11:13:49.888656 IP 192.168.1.5.52961 > 172.217.12.206.443: UDP, length 28
2018-08-30 11:13:49.890262 IP 192.168.1.5.52961 > 172.217.12.206.443: UDP, length 28
2018-08-30 11:13:49.890311 IP 192.168.1.5.52961 > 172.217.12.206.443: UDP, length 28
2018-08-30 11:13:49.893300 IP 192.168.1.5.52961 > 172.217.12.206.443: UDP, length 28
2018-08-30 11:13:49.893413 IP 192.168.1.5.52961 > 172.217.12.206.443: UDP, length 28
2018-08-30 11:13:49.894101 IP 192.168.1.5.52961 > 172.217.12.206.443: UDP, length 28
2018-08-30 11:13:49.894954 IP 192.168.1.5.52961 > 172.217.12.206.443: UDP, length 28
2018-08-30 11:13:49.895689 IP 192.168.1.5.52961 > 172.217.12.206.443: UDP, length 28
2018-08-30 11:13:49.897188 IP 192.168.1.5.52961 > 172.217.12.206.443: UDP, length 28
2018-08-30 11:13:49.898607 IP 192.168.1.5.52961 > 172.217.12.206.443: UDP, length 28
2018-08-30 11:13:49.899409 IP 192.168.1.5.52961 > 172.217.12.206.443: UDP, length 28
2018-08-30 11:13:49.900615 IP 192.168.1.5.52961 > 172.217.12.206.443: UDP, length 28
2018-08-30 11:13:49.960364 IP 192.168.1.5.62937 > 172.217.12.206.443: UDP, length 1350
2018-08-30 11:13:49.960579 IP 192.168.1.5.62937 > 172.217.12.206.443: UDP, length 359
2018-08-30 11:13:50.016684 IP 192.168.1.5.62937 > 172.217.12.206.443: UDP, length 1350
2018-08-30 11:13:50.027012 IP 192.168.1.5.62937 > 172.217.12.206.443: UDP, length 1350
2018-08-30 11:13:50.027057 IP 192.168.1.5.62937 > 172.217.12.206.443: UDP, length 355
2018-08-30 11:13:50.061136 IP 192.168.1.5.62937 > 172.217.12.206.443: UDP, length 47
2018-08-30 11:13:50.086436 IP 192.168.1.5.62937 > 172.217.12.206.443: UDP, length 28
2018-08-30 11:13:50.095778 IP 192.168.1.5.62937 > 172.217.12.206.443: UDP, length 355
2018-08-30 11:13:50.121203 IP 192.168.1.5.62937 > 172.217.12.206.443: UDP, length 28
2018-08-30 11:13:50.121388 IP 192.168.1.5.62937 > 172.217.12.206.443: UDP, length 28
2018-08-30 11:13:50.121594 IP 192.168.1.5.62937 > 172.217.12.206.443: UDP, length 28
2018-08-30 11:13:50.122822 IP 192.168.1.5.62937 > 172.217.12.206.443: UDP, length 28
2018-08-30 11:13:50.122926 IP 192.168.1.5.62937 > 172.217.12.206.443: UDP, length 28
2018-08-30 11:13:50.122926 IP 192.168.1.5.62937 > 172.217.12.206.443: UDP, length 28
2018-08-30 11:13:50.124260 IP 192.168.1.5.62937 > 172.217.12.206.443: UDP, length 28
2018-08-30 11:13:50.125784 IP 192.168.1.5.62937 > 172.217.12.206.443: UDP, length 28
2018-08-30 11:13:50.126258 IP 192.168.1.5.62937 > 172.217.12.206.443: UDP, length 28
2018-08-30 11:13:50.128000 IP 192.168.1.5.62937 > 172.217.12.206.443: UDP, length 28
2018-08-30 11:13:50.130042 IP 192.168.1.5.62937 > 172.217.12.206.443: UDP, length 28
2018-08-30 11:13:50.131391 IP 192.168.1.5.62937 > 172.217.12.206.443: UDP, length 28
2018-08-30 11:13:50.133207 IP 192.168.1.5.62937 > 172.217.12.206.443: UDP, length 28
2018-08-30 11:13:50.134796 IP 192.168.1.5.62937 > 172.217.12.206.443: UDP, length 28
2018-08-30 11:13:50.136934 IP 192.168.1.5.62937 > 172.217.12.206.443: UDP, length 28
2018-08-30 11:13:50.137236 IP 192.168.1.5.62937 > 172.217.12.206.443: UDP, length 28
2018-08-30 11:13:50.140511 IP 192.168.1.5.62937 > 172.217.12.206.443: UDP, length 28
2018-08-30 11:13:50.141478 IP 192.168.1.5.62937 > 172.217.12.206.443: UDP, length 28
2018-08-30 11:13:50.142535 IP 192.168.1.5.62937 > 172.217.12.206.443: UDP, length 28
2018-08-30 11:13:50.162601 IP 192.168.1.5.62937 > 172.217.12.206.443: UDP, length 41
2018-08-30 11:13:50.162646 IP 192.168.1.5.62937 > 172.217.12.206.443: UDP, length 28
2018-08-30 11:13:50.162676 IP 192.168.1.5.62937 > 172.217.12.206.443: UDP, length 28
2018-08-30 11:13:50.162723 IP 192.168.1.5.62937 > 172.217.12.206.443: UDP, length 28
2018-08-30 11:13:50.162751 IP 192.168.1.5.62937 > 172.217.12.206.443: UDP, length 28
2018-08-30 11:13:50.162781 IP 192.168.1.5.62937 > 172.217.12.206.443: UDP, length 28
2018-08-30 11:13:50.163915 IP 192.168.1.5.62937 > 172.217.12.206.443: UDP, length 28
2018-08-30 11:13:50.164410 IP 192.168.1.5.62937 > 172.217.12.206.443: UDP, length 28
2018-08-30 11:13:50.164484 IP 192.168.1.5.62937 > 172.217.12.206.443: UDP, length 28
2018-08-30 11:13:50.164779 IP 192.168.1.5.62937 > 172.217.12.206.443: UDP, length 28
2018-08-30 11:13:50.164885 IP 192.168.1.5.62937 > 172.217.12.206.443: UDP, length 28
2018-08-30 11:13:50.165770 IP 192.168.1.5.62937 > 172.217.12.206.443: UDP, length 28
2018-08-30 11:13:50.167752 IP 192.168.1.5.62937 > 172.217.12.206.443: UDP, length 28
2018-08-30 11:13:50.167752 IP 192.168.1.5.62937 > 172.217.12.206.443: UDP, length 28
2018-08-30 11:13:50.167834 IP 192.168.1.5.62937 > 172.217.12.206.443: UDP, length 28
2018-08-30 11:13:50.167909 IP 192.168.1.5.62937 > 172.217.12.206.443: UDP, length 28
2018-08-30 11:13:50.168226 IP 192.168.1.5.62937 > 172.217.12.206.443: UDP, length 28
2018-08-30 11:13:50.169637 IP 192.168.1.5.62937 > 172.217.12.206.443: UDP, length 28
2018-08-30 11:13:50.170050 IP 192.168.1.5.62937 > 172.217.12.206.443: UDP, length 28
2018-08-30 11:13:50.173863 IP 192.168.1.5.62937 > 172.217.12.206.443: UDP, length 28
2018-08-30 11:13:50.174087 IP 192.168.1.5.62937 > 172.217.12.206.443: UDP, length 41
2018-08-30 11:13:50.174264 IP 192.168.1.5.62937 > 172.217.12.206.443: UDP, length 28
2018-08-30 11:13:50.174411 IP 192.168.1.5.62937 > 172.217.12.206.443: UDP, length 28
2018-08-30 11:13:50.175141 IP 192.168.1.5.62937 > 172.217.12.206.443: UDP, length 28
2018-08-30 11:13:50.175201 IP 192.168.1.5.62937 > 172.217.12.206.443: UDP, length 28
2018-08-30 11:13:50.175389 IP 192.168.1.5.62937 > 172.217.12.206.443: UDP, length 28
2018-08-30 11:13:50.176092 IP 192.168.1.5.62937 > 172.217.12.206.443: UDP, length 28
2018-08-30 11:13:50.180573 IP 192.168.1.5.62937 > 172.217.12.206.443: UDP, length 28
2018-08-30 11:13:50.185193 IP 192.168.1.5.62937 > 172.217.12.206.443: UDP, length 28
2018-08-30 11:13:50.187758 IP 192.168.1.5.62937 > 172.217.12.206.443: UDP, length 28
2018-08-30 11:13:50.189846 IP 192.168.1.5.62937 > 172.217.12.206.443: UDP, length 28
2018-08-30 11:13:50.192350 IP 192.168.1.5.62937 > 172.217.12.206.443: UDP, length 28
2018-08-30 11:13:50.196898 IP 192.168.1.5.62937 > 172.217.12.206.443: UDP, length 28
2018-08-30 11:13:50.201075 IP 192.168.1.5.62937 > 172.217.12.206.443: UDP, length 28
2018-08-30 11:13:50.205437 IP 192.168.1.5.62937 > 172.217.12.206.443: UDP, length 28
2018-08-30 11:13:50.212529 IP 192.168.1.5.62937 > 172.217.12.206.443: UDP, length 28
2018-08-30 11:13:50.216395 IP 192.168.1.5.62937 > 172.217.12.206.443: UDP, length 28
2018-08-30 11:13:50.218449 IP 192.168.1.5.62937 > 172.217.12.206.443: UDP, length 28
2018-08-30 11:13:50.218602 IP 192.168.1.5.62937 > 172.217.12.206.443: UDP, length 28
2018-08-30 11:13:50.218725 IP 192.168.1.5.62937 > 172.217.12.206.443: UDP, length 28
2018-08-30 11:13:50.220581 IP 192.168.1.5.62937 > 172.217.12.206.443: UDP, length 41
2018-08-30 11:13:50.220721 IP 192.168.1.5.50288 > 172.217.11.46.443: UDP, length 28
2018-08-30 11:13:50.220784 IP 192.168.1.5.50288 > 172.217.11.46.443: UDP, length 28
2018-08-30 11:13:50.221122 IP 192.168.1.5.50288 > 172.217.11.46.443: UDP, length 28
2018-08-30 11:13:50.221168 IP 192.168.1.5.50288 > 172.217.11.46.443: UDP, length 28
2018-08-30 11:13:50.224350 IP 192.168.1.5.50288 > 172.217.11.46.443: UDP, length 28
2018-08-30 11:13:50.224351 IP 192.168.1.5.50288 > 172.217.11.46.443: UDP, length 28
2018-08-30 11:13:50.224398 IP 192.168.1.5.50288 > 172.217.11.46.443: UDP, length 28
2018-08-30 11:13:50.224538 IP 192.168.1.5.50288 > 172.217.11.46.443: UDP, length 28
2018-08-30 11:13:50.225724 IP 192.168.1.5.50288 > 172.217.11.46.443: UDP, length 28
2018-08-30 11:13:50.225760 IP 192.168.1.5.50288 > 172.217.11.46.443: UDP, length 28
2018-08-30 11:13:50.226860 IP 192.168.1.5.50288 > 172.217.11.46.443: UDP, length 41
2018-08-30 11:13:50.226897 IP 192.168.1.5.50288 > 172.217.11.46.443: UDP, length 28
2018-08-30 11:13:50.249185 IP 192.168.1.5.62017 > 192.0.73.2.443: Flags [.], ack 3334038026, win 8192, length 0
2018-08-30 11:13:50.259878 IP 192.168.1.5.50288 > 172.217.11.46.443: UDP, length 28
2018-08-30 11:13:50.371567 IP 192.168.1.5.56822 > 167.206.252.143.443: UDP, length 690
2018-08-30 11:13:50.377773 IP 192.168.1.5.56822 > 167.206.252.143.443: UDP, length 604
2018-08-30 11:13:50.407169 IP 192.168.1.5.56822 > 167.206.252.143.443: UDP, length 28
2018-08-30 11:13:50.407274 IP 192.168.1.5.56822 > 167.206.252.143.443: UDP, length 28
2018-08-30 11:13:50.407511 IP 192.168.1.5.56822 > 167.206.252.143.443: UDP, length 28
2018-08-30 11:13:50.407567 IP 192.168.1.5.56822 > 167.206.252.143.443: UDP, length 28
2018-08-30 11:13:50.407650 IP 192.168.1.5.56822 > 167.206.252.143.443: UDP, length 28
2018-08-30 11:13:50.407734 IP 192.168.1.5.56822 > 167.206.252.143.443: UDP, length 28
2018-08-30 11:13:50.407808 IP 192.168.1.5.56822 > 167.206.252.143.443: UDP, length 28
2018-08-30 11:13:50.409670 IP 192.168.1.5.56822 > 167.206.252.143.443: UDP, length 28
2018-08-30 11:13:50.409893 IP 192.168.1.5.56822 > 167.206.252.143.443: UDP, length 28
2018-08-30 11:13:50.409893 IP 192.168.1.5.56822 > 167.206.252.143.443: UDP, length 28
2018-08-30 11:13:50.411986 IP 192.168.1.5.56822 > 167.206.252.143.443: UDP, length 28
2018-08-30 11:13:50.412022 IP 192.168.1.5.56822 > 167.206.252.143.443: UDP, length 28
2018-08-30 11:13:50.412408 IP 192.168.1.5.56822 > 167.206.252.143.443: UDP, length 28
2018-08-30 11:13:50.412450 IP 192.168.1.5.56822 > 167.206.252.143.443: UDP, length 28
2018-08-30 11:13:50.413297 IP 192.168.1.5.56822 > 167.206.252.143.443: UDP, length 28
2018-08-30 11:13:50.414770 IP 192.168.1.5.56822 > 167.206.252.143.443: UDP, length 28
2018-08-30 11:13:50.416537 IP 192.168.1.5.56822 > 167.206.252.143.443: UDP, length 28
2018-08-30 11:13:50.421153 IP 192.168.1.5.56822 > 167.206.252.143.443: UDP, length 28
2018-08-30 11:13:50.421265 IP 192.168.1.5.56822 > 167.206.252.143.443: UDP, length 28
2018-08-30 11:13:50.421455 IP 192.168.1.5.56822 > 167.206.252.143.443: UDP, length 41
2018-08-30 11:13:50.421697 IP 192.168.1.5.56822 > 167.206.252.143.443: UDP, length 28
2018-08-30 11:13:50.423375 IP 192.168.1.5.56822 > 167.206.252.143.443: UDP, length 28
2018-08-30 11:13:50.426385 IP 192.168.1.5.56822 > 167.206.252.143.443: UDP, length 28
2018-08-30 11:13:50.427843 IP 192.168.1.5.56822 > 167.206.252.143.443: UDP, length 28
2018-08-30 11:13:50.428497 IP 192.168.1.5.56822 > 167.206.252.143.443: UDP, length 28
2018-08-30 11:13:50.428543 IP 192.168.1.5.56822 > 167.206.252.143.443: UDP, length 28
2018-08-30 11:13:50.429918 IP 192.168.1.5.56822 > 167.206.252.143.443: UDP, length 28
2018-08-30 11:13:50.430015 IP 192.168.1.5.56822 > 167.206.252.143.443: UDP, length 28
2018-08-30 11:13:50.431283 IP 192.168.1.5.56822 > 167.206.252.143.443: UDP, length 28
2018-08-30 11:13:50.431895 IP 192.168.1.5.56822 > 167.206.252.143.443: UDP, length 28
2018-08-30 11:13:50.433240 IP 192.168.1.5.56822 > 167.206.252.143.443: UDP, length 28
2018-08-30 11:13:50.433288 IP 192.168.1.5.56822 > 167.206.252.143.443: UDP, length 28
2018-08-30 11:13:50.433869 IP 192.168.1.5.56822 > 167.206.252.143.443: UDP, length 28
2018-08-30 11:13:50.435555 IP 192.168.1.5.56822 > 167.206.252.143.443: UDP, length 28
2018-08-30 11:13:50.435616 IP 192.168.1.5.56822 > 167.206.252.143.443: UDP, length 28
2018-08-30 11:13:50.435725 IP 192.168.1.5.56822 > 167.206.252.143.443: UDP, length 28
2018-08-30 11:13:50.436669 IP 192.168.1.5.56822 > 167.206.252.143.443: UDP, length 28
2018-08-30 11:13:50.437079 IP 192.168.1.5.56822 > 167.206.252.143.443: UDP, length 28
2018-08-30 11:13:50.437997 IP 192.168.1.5.56822 > 167.206.252.143.443: UDP, length 28
2018-08-30 11:13:50.438550 IP 192.168.1.5.56822 > 167.206.252.143.443: UDP, length 41
2018-08-30 11:13:50.438864 IP 192.168.1.5.56822 > 167.206.252.143.443: UDP, length 28
2018-08-30 11:13:50.438865 IP 192.168.1.5.56822 > 167.206.252.143.443: UDP, length 28
2018-08-30 11:13:50.440469 IP 192.168.1.5.56822 > 167.206.252.143.443: UDP, length 28
2018-08-30 11:13:50.440590 IP 192.168.1.5.56822 > 167.206.252.143.443: UDP, length 28
2018-08-30 11:13:50.440664 IP 192.168.1.5.56822 > 167.206.252.143.443: UDP, length 28
2018-08-30 11:13:50.441056 IP 192.168.1.5.56822 > 167.206.252.143.443: UDP, length 28
2018-08-30 11:13:50.448952 IP 192.168.1.5.56822 > 167.206.252.143.443: UDP, length 28
2018-08-30 11:13:50.450008 IP 192.168.1.5.56822 > 167.206.252.143.443: UDP, length 28
2018-08-30 11:13:50.451931 IP 192.168.1.5.56822 > 167.206.252.143.443: UDP, length 28
2018-08-30 11:13:50.453854 IP 192.168.1.5.56822 > 167.206.252.143.443: UDP, length 28
2018-08-30 11:13:50.454516 IP 192.168.1.5.56822 > 167.206.252.143.443: UDP, length 28
2018-08-30 11:13:50.457781 IP 192.168.1.5.56822 > 167.206.252.143.443: UDP, length 28
2018-08-30 11:13:50.457962 IP 192.168.1.5.56822 > 167.206.252.143.443: UDP, length 28
2018-08-30 11:13:50.459941 IP 192.168.1.5.56822 > 167.206.252.143.443: UDP, length 28
2018-08-30 11:13:50.461691 IP 192.168.1.5.56822 > 167.206.252.143.443: UDP, length 28
2018-08-30 11:13:50.465136 IP 192.168.1.5.56822 > 167.206.252.143.443: UDP, length 28
2018-08-30 11:13:50.469161 IP 192.168.1.5.56822 > 167.206.252.143.443: UDP, length 28
2018-08-30 11:13:50.470103 IP 192.168.1.5.56822 > 167.206.252.143.443: UDP, length 28
2018-08-30 11:13:50.472194 IP 192.168.1.5.56822 > 167.206.252.143.443: UDP, length 28
2018-08-30 11:13:50.473895 IP 192.168.1.5.56822 > 167.206.252.143.443: UDP, length 41
2018-08-30 11:13:50.477457 IP 192.168.1.5.56822 > 167.206.252.143.443: UDP, length 28
2018-08-30 11:13:50.477843 IP 192.168.1.5.56822 > 167.206.252.143.443: UDP, length 28
2018-08-30 11:13:50.478008 IP 192.168.1.5.56822 > 167.206.252.143.443: UDP, length 29
2018-08-30 11:13:50.481784 IP 192.168.1.5.56822 > 167.206.252.143.443: UDP, length 29
2018-08-30 11:13:50.485343 IP 192.168.1.5.56822 > 167.206.252.143.443: UDP, length 29
2018-08-30 11:13:50.486158 IP 192.168.1.5.56822 > 167.206.252.143.443: UDP, length 29
2018-08-30 11:13:50.487819 IP 192.168.1.5.56822 > 167.206.252.143.443: UDP, length 29
2018-08-30 11:13:50.489477 IP 192.168.1.5.56822 > 167.206.252.143.443: UDP, length 29
2018-08-30 11:13:50.493074 IP 192.168.1.5.56822 > 167.206.252.143.443: UDP, length 29
2018-08-30 11:13:50.495459 IP 192.168.1.5.56822 > 167.206.252.143.443: UDP, length 29
2018-08-30 11:13:50.495537 IP 192.168.1.5.56822 > 167.206.252.143.443: UDP, length 29
2018-08-30 11:13:50.496369 IP 192.168.1.5.56822 > 167.206.252.143.443: UDP, length 29
2018-08-30 11:13:50.500295 IP 192.168.1.5.56822 > 167.206.252.143.443: UDP, length 29
2018-08-30 11:13:50.553719 IP 192.168.1.5.50288 > 172.217.11.46.443: UDP, length 454
2018-08-30 11:13:50.562689 IP 192.168.1.5.56822 > 167.206.252.143.443: UDP, length 670
2018-08-30 11:13:50.588681 IP 192.168.1.5.56822 > 167.206.252.143.443: UDP, length 29
2018-08-30 11:13:50.596801 IP 192.168.1.5.56822 > 167.206.252.143.443: UDP, length 29
2018-08-30 11:13:50.596908 IP 192.168.1.5.56822 > 167.206.252.143.443: UDP, length 29
2018-08-30 11:13:50.597032 IP 192.168.1.5.56822 > 167.206.252.143.443: UDP, length 29
2018-08-30 11:13:50.600879 IP 192.168.1.5.56822 > 167.206.252.143.443: UDP, length 29
2018-08-30 11:13:50.601151 IP 192.168.1.5.56822 > 167.206.252.143.443: UDP, length 29
2018-08-30 11:13:50.603089 IP 192.168.1.5.56822 > 167.206.252.143.443: UDP, length 29
2018-08-30 11:13:50.603271 IP 192.168.1.5.56822 > 167.206.252.143.443: UDP, length 29
2018-08-30 11:13:50.603513 IP 192.168.1.5.56822 > 167.206.252.143.443: UDP, length 29
2018-08-30 11:13:50.603782 IP 192.168.1.5.56822 > 167.206.252.143.443: UDP, length 29
2018-08-30 11:13:50.604842 IP 192.168.1.5.56822 > 167.206.252.143.443: UDP, length 29
2018-08-30 11:13:50.605865 IP 192.168.1.5.56822 > 167.206.252.143.443: UDP, length 29
2018-08-30 11:13:50.608200 IP 192.168.1.5.56822 > 167.206.252.143.443: UDP, length 29
2018-08-30 11:13:50.611055 IP 192.168.1.5.56822 > 167.206.252.143.443: UDP, length 29
2018-08-30 11:13:50.611195 IP 192.168.1.5.56822 > 167.206.252.143.443: UDP, length 29
2018-08-30 11:13:50.611306 IP 192.168.1.5.56822 > 167.206.252.143.443: UDP, length 29
2018-08-30 11:13:50.611772 IP 192.168.1.5.56822 > 167.206.252.143.443: UDP, length 29
2018-08-30 11:13:50.612797 IP 192.168.1.5.56822 > 167.206.252.143.443: UDP, length 29
2018-08-30 11:13:50.613742 IP 192.168.1.5.56822 > 167.206.252.143.443: UDP, length 29
2018-08-30 11:13:50.616786 IP 192.168.1.5.56822 > 167.206.252.143.443: UDP, length 42
2018-08-30 11:13:50.619747 IP 192.168.1.5.56822 > 167.206.252.143.443: UDP, length 29
2018-08-30 11:13:50.625745 IP 192.168.1.5.56822 > 167.206.252.143.443: UDP, length 29
2018-08-30 11:13:50.625937 IP 192.168.1.5.56822 > 167.206.252.143.443: UDP, length 29
2018-08-30 11:13:50.626126 IP 192.168.1.5.56822 > 167.206.252.143.443: UDP, length 29
2018-08-30 11:13:50.627291 IP 192.168.1.5.56822 > 167.206.252.143.443: UDP, length 29
2018-08-30 11:13:50.627765 IP 192.168.1.5.56822 > 167.206.252.143.443: UDP, length 29
2018-08-30 11:13:50.629130 IP 192.168.1.5.56822 > 167.206.252.143.443: UDP, length 29
2018-08-30 11:13:50.630210 IP 192.168.1.5.56822 > 167.206.252.143.443: UDP, length 29
2018-08-30 11:13:50.634326 IP 192.168.1.5.56822 > 167.206.252.143.443: UDP, length 29
2018-08-30 11:13:50.647592 IP 192.168.1.5.56822 > 167.206.252.143.443: UDP, length 610
2018-08-30 11:13:50.681904 IP 192.168.1.5.56822 > 167.206.252.143.443: UDP, length 29
2018-08-30 11:13:50.684204 IP 192.168.1.5.56822 > 167.206.252.143.443: UDP, length 29
2018-08-30 11:13:50.684600 IP 192.168.1.5.56822 > 167.206.252.143.443: UDP, length 29
2018-08-30 11:13:50.685240 IP 192.168.1.5.56822 > 167.206.252.143.443: UDP, length 29
2018-08-30 11:13:50.686007 IP 192.168.1.5.56822 > 167.206.252.143.443: UDP, length 29
2018-08-30 11:13:50.688749 IP 192.168.1.5.56822 > 167.206.252.143.443: UDP, length 29
2018-08-30 11:13:50.689003 IP 192.168.1.5.56822 > 167.206.252.143.443: UDP, length 29
2018-08-30 11:13:50.689354 IP 192.168.1.5.50288 > 172.217.11.46.443: UDP, length 28
2018-08-30 11:13:50.714719 IP 192.168.1.5.50288 > 172.217.11.46.443: UDP, length 28
2018-08-30 11:13:50.722393 IP 192.168.1.5.56822 > 167.206.252.143.443: UDP, length 673
2018-08-30 11:13:50.750250 IP 192.168.1.5.62012 > 151.101.65.69.443: Flags [.], ack 3717043282, win 4096, length 0
2018-08-30 11:13:50.853652 IP 192.168.1.5.56822 > 167.206.252.143.443: UDP, length 673
2018-08-30 11:13:50.870309 IP 192.168.1.5.56822 > 167.206.252.143.443: UDP, length 29
2018-08-30 11:13:50.872642 IP 192.168.1.5.56822 > 167.206.252.143.443: UDP, length 29
2018-08-30 11:13:50.872713 IP 192.168.1.5.56822 > 167.206.252.143.443: UDP, length 29
2018-08-30 11:13:50.872993 IP 192.168.1.5.56822 > 167.206.252.143.443: UDP, length 29
2018-08-30 11:13:50.873857 IP 192.168.1.5.56822 > 167.206.252.143.443: UDP, length 29
2018-08-30 11:13:50.877928 IP 192.168.1.5.56822 > 167.206.252.143.443: UDP, length 29
2018-08-30 11:13:50.882876 IP 192.168.1.5.56822 > 167.206.252.143.443: UDP, length 29
2018-08-30 11:13:50.883146 IP 192.168.1.5.56822 > 167.206.252.143.443: UDP, length 29
2018-08-30 11:13:50.889609 IP 192.168.1.5.56822 > 167.206.252.143.443: UDP, length 29
2018-08-30 11:13:50.889766 IP 192.168.1.5.56822 > 167.206.252.143.443: UDP, length 29
2018-08-30 11:13:50.890085 IP 192.168.1.5.56822 > 167.206.252.143.443: UDP, length 29
2018-08-30 11:13:50.890233 IP 192.168.1.5.56822 > 167.206.252.143.443: UDP, length 29
2018-08-30 11:13:50.890605 IP 192.168.1.5.56822 > 167.206.252.143.443: UDP, length 29
2018-08-30 11:13:50.890878 IP 192.168.1.5.56822 > 167.206.252.143.443: UDP, length 29
2018-08-30 11:13:50.893127 IP 192.168.1.5.56822 > 167.206.252.143.443: UDP, length 29
2018-08-30 11:13:50.899817 IP 192.168.1.5.56822 > 167.206.252.143.443: UDP, length 29
2018-08-30 11:13:50.902728 IP 192.168.1.5.56822 > 167.206.252.143.443: UDP, length 29
2018-08-30 11:13:50.906329 IP 192.168.1.5.56822 > 167.206.252.143.443: UDP, length 29
2018-08-30 11:13:50.906649 IP 192.168.1.5.56822 > 167.206.252.143.443: UDP, length 29
2018-08-30 11:13:50.906800 IP 192.168.1.5.56822 > 167.206.252.143.443: UDP, length 42
2018-08-30 11:13:50.906943 IP 192.168.1.5.56822 > 167.206.252.143.443: UDP, length 29
2018-08-30 11:13:50.907148 IP 192.168.1.5.56822 > 167.206.252.143.443: UDP, length 29
2018-08-30 11:13:50.911996 IP 192.168.1.5.56822 > 167.206.252.143.443: UDP, length 29
2018-08-30 11:13:50.912140 IP 192.168.1.5.56822 > 167.206.252.143.443: UDP, length 29
2018-08-30 11:13:50.913954 IP 192.168.1.5.56822 > 167.206.252.143.443: UDP, length 29
2018-08-30 11:13:50.914132 IP 192.168.1.5.56822 > 167.206.252.143.443: UDP, length 29
2018-08-30 11:13:50.914305 IP 192.168.1.5.56822 > 167.206.252.143.443: UDP, length 29
2018-08-30 11:13:50.914685 IP 192.168.1.5.56822 > 167.206.252.143.443: UDP, length 29
2018-08-30 11:13:50.917629 IP 192.168.1.5.56822 > 167.206.252.143.443: UDP, length 29
2018-08-30 11:13:50.917793 IP 192.168.1.5.56822 > 167.206.252.143.443: UDP, length 29
2018-08-30 11:13:50.917854 IP 192.168.1.5.56822 > 167.206.252.143.443: UDP, length 29
2018-08-30 11:13:50.921300 IP 192.168.1.5.56822 > 167.206.252.143.443: UDP, length 29
2018-08-30 11:13:50.922057 IP 192.168.1.5.56822 > 167.206.252.143.443: UDP, length 29
2018-08-30 11:13:50.922177 IP 192.168.1.5.56822 > 167.206.252.143.443: UDP, length 29
2018-08-30 11:13:50.922284 IP 192.168.1.5.56822 > 167.206.252.143.443: UDP, length 29
2018-08-30 11:13:50.922418 IP 192.168.1.5.56822 > 167.206.252.143.443: UDP, length 29
2018-08-30 11:13:50.925856 IP 192.168.1.5.56822 > 167.206.252.143.443: UDP, length 29
2018-08-30 11:13:50.960312 IP 192.168.1.5.56822 > 167.206.252.143.443: UDP, length 29
2018-08-30 11:13:50.961130 IP 192.168.1.5.56822 > 167.206.252.143.443: UDP, length 29
2018-08-30 11:13:50.962818 IP 192.168.1.5.56822 > 167.206.252.143.443: UDP, length 42
2018-08-30 11:13:50.963587 IP 192.168.1.5.56822 > 167.206.252.143.443: UDP, length 29
2018-08-30 11:13:50.967313 IP 192.168.1.5.56822 > 167.206.252.143.443: UDP, length 29
2018-08-30 11:13:50.968567 IP 192.168.1.5.56822 > 167.206.252.143.443: UDP, length 29
2018-08-30 11:13:50.968843 IP 192.168.1.5.56822 > 167.206.252.143.443: UDP, length 29
2018-08-30 11:13:50.972191 IP 192.168.1.5.56822 > 167.206.252.143.443: UDP, length 29
2018-08-30 11:13:50.973074 IP 192.168.1.5.56822 > 167.206.252.143.443: UDP, length 29
2018-08-30 11:13:50.973141 IP 192.168.1.5.56822 > 167.206.252.143.443: UDP, length 29
2018-08-30 11:13:50.973231 IP 192.168.1.5.56822 > 167.206.252.143.443: UDP, length 29
2018-08-30 11:13:50.973306 IP 192.168.1.5.56822 > 167.206.252.143.443: UDP, length 29
2018-08-30 11:13:50.974315 IP 192.168.1.5.56822 > 167.206.252.143.443: UDP, length 29
2018-08-30 11:13:50.977550 IP 192.168.1.5.56822 > 167.206.252.143.443: UDP, length 29
2018-08-30 11:13:50.977642 IP 192.168.1.5.56822 > 167.206.252.143.443: UDP, length 29
2018-08-30 11:13:50.977731 IP 192.168.1.5.56822 > 167.206.252.143.443: UDP, length 29
2018-08-30 11:13:50.981595 IP 192.168.1.5.56822 > 167.206.252.143.443: UDP, length 29
2018-08-30 11:13:51.075829 IP 192.168.1.5.56822 > 167.206.252.143.443: UDP, length 630
2018-08-30 11:13:51.092231 IP 192.168.1.5.56822 > 167.206.252.143.443: UDP, length 29
2018-08-30 11:13:51.095583 IP 192.168.1.5.56822 > 167.206.252.143.443: UDP, length 29
2018-08-30 11:13:51.096762 IP 192.168.1.5.56822 > 167.206.252.143.443: UDP, length 29
2018-08-30 11:13:51.099134 IP 192.168.1.5.56822 > 167.206.252.143.443: UDP, length 29
2018-08-30 11:13:51.100877 IP 192.168.1.5.56822 > 167.206.252.143.443: UDP, length 29
2018-08-30 11:13:51.105362 IP 192.168.1.5.56822 > 167.206.252.143.443: UDP, length 29
2018-08-30 11:13:51.111159 IP 192.168.1.5.56822 > 167.206.252.143.443: UDP, length 29
2018-08-30 11:13:51.111728 IP 192.168.1.5.56822 > 167.206.252.143.443: UDP, length 29
2018-08-30 11:13:51.111867 IP 192.168.1.5.56822 > 167.206.252.143.443: UDP, length 29
2018-08-30 11:13:51.111980 IP 192.168.1.5.56822 > 167.206.252.143.443: UDP, length 29
2018-08-30 11:13:51.115352 IP 192.168.1.5.56822 > 167.206.252.143.443: UDP, length 29
2018-08-30 11:13:51.117308 IP 192.168.1.5.56822 > 167.206.252.143.443: UDP, length 29
2018-08-30 11:13:51.117410 IP 192.168.1.5.56822 > 167.206.252.143.443: UDP, length 29
2018-08-30 11:13:51.117745 IP 192.168.1.5.56822 > 167.206.252.143.443: UDP, length 29
2018-08-30 11:13:51.117995 IP 192.168.1.5.56822 > 167.206.252.143.443: UDP, length 29
2018-08-30 11:13:51.121780 IP 192.168.1.5.56822 > 167.206.252.143.443: UDP, length 29
2018-08-30 11:13:52.037812 IP 192.168.1.5.56822 > 167.206.252.143.443: UDP, length 674
2018-08-30 11:13:52.043254 IP 192.168.1.5.52961 > 172.217.12.206.443: UDP, length 154
2018-08-30 11:13:52.057630 IP 192.168.1.5.56822 > 167.206.252.143.443: UDP, length 29
2018-08-30 11:13:52.068477 IP 192.168.1.5.56822 > 167.206.252.143.443: UDP, length 29
2018-08-30 11:13:52.068620 IP 192.168.1.5.56822 > 167.206.252.143.443: UDP, length 29
2018-08-30 11:13:52.068955 IP 192.168.1.5.56822 > 167.206.252.143.443: UDP, length 29
2018-08-30 11:13:52.069978 IP 192.168.1.5.56822 > 167.206.252.143.443: UDP, length 29
2018-08-30 11:13:52.070980 IP 192.168.1.5.56822 > 167.206.252.143.443: UDP, length 29
2018-08-30 11:13:52.072234 IP 192.168.1.5.56822 > 167.206.252.143.443: UDP, length 29
2018-08-30 11:13:52.072888 IP 192.168.1.5.56822 > 167.206.252.143.443: UDP, length 29
2018-08-30 11:13:52.073907 IP 192.168.1.5.56822 > 167.206.252.143.443: UDP, length 29
2018-08-30 11:13:52.077642 IP 192.168.1.5.56822 > 167.206.252.143.443: UDP, length 29
2018-08-30 11:13:52.077756 IP 192.168.1.5.56822 > 167.206.252.143.443: UDP, length 29
2018-08-30 11:13:52.077856 IP 192.168.1.5.56822 > 167.206.252.143.443: UDP, length 29
2018-08-30 11:13:52.081301 IP 192.168.1.5.56822 > 167.206.252.143.443: UDP, length 29
2018-08-30 11:13:52.081953 IP 192.168.1.5.56822 > 167.206.252.143.443: UDP, length 29
2018-08-30 11:13:52.085490 IP 192.168.1.5.56822 > 167.206.252.143.443: UDP, length 29
2018-08-30 11:13:52.089675 IP 192.168.1.5.56822 > 167.206.252.143.443: UDP, length 29
2018-08-30 11:13:52.089795 IP 192.168.1.5.56822 > 167.206.252.143.443: UDP, length 29
2018-08-30 11:13:52.091654 IP 192.168.1.5.56822 > 167.206.252.143.443: UDP, length 29
2018-08-30 11:13:52.091825 IP 192.168.1.5.56822 > 167.206.252.143.443: UDP, length 29
2018-08-30 11:13:52.091997 IP 192.168.1.5.56822 > 167.206.252.143.443: UDP, length 42
2018-08-30 11:13:52.093731 IP 192.168.1.5.56822 > 167.206.252.143.443: UDP, length 29
2018-08-30 11:13:52.093816 IP 192.168.1.5.56822 > 167.206.252.143.443: UDP, length 29
2018-08-30 11:13:52.093891 IP 192.168.1.5.56822 > 167.206.252.143.443: UDP, length 29
2018-08-30 11:13:52.097506 IP 192.168.1.5.56822 > 167.206.252.143.443: UDP, length 29
2018-08-30 11:13:52.115609 IP 192.168.1.5.52961 > 172.217.12.206.443: UDP, length 28
2018-08-30 11:13:52.133346 IP 192.168.1.5.52961 > 172.217.12.206.443: UDP, length 82
2018-08-30 11:13:52.135827 IP 192.168.1.5.56822 > 167.206.252.143.443: UDP, length 29
2018-08-30 11:13:52.139099 IP 192.168.1.5.56822 > 167.206.252.143.443: UDP, length 29
2018-08-30 11:13:52.139204 IP 192.168.1.5.56822 > 167.206.252.143.443: UDP, length 29
2018-08-30 11:13:52.139971 IP 192.168.1.5.56822 > 167.206.252.143.443: UDP, length 29
2018-08-30 11:13:52.140839 IP 192.168.1.5.56822 > 167.206.252.143.443: UDP, length 29
2018-08-30 11:13:52.144445 IP 192.168.1.5.56822 > 167.206.252.143.443: UDP, length 29
2018-08-30 11:13:52.144563 IP 192.168.1.5.56822 > 167.206.252.143.443: UDP, length 29
2018-08-30 11:13:52.144714 IP 192.168.1.5.56822 > 167.206.252.143.443: UDP, length 29
2018-08-30 11:13:52.148429 IP 192.168.1.5.56822 > 167.206.252.143.443: UDP, length 29
2018-08-30 11:13:52.149616 IP 192.168.1.5.56822 > 167.206.252.143.443: UDP, length 29
2018-08-30 11:13:52.149757 IP 192.168.1.5.56822 > 167.206.252.143.443: UDP, length 29
2018-08-30 11:13:52.149879 IP 192.168.1.5.56822 > 167.206.252.143.443: UDP, length 29
2018-08-30 11:13:52.150160 IP 192.168.1.5.56822 > 167.206.252.143.443: UDP, length 29
2018-08-30 11:13:52.153407 IP 192.168.1.5.56822 > 167.206.252.143.443: UDP, length 29
2018-08-30 11:13:52.155909 IP 192.168.1.5.56822 > 167.206.252.143.443: UDP, length 29
2018-08-30 11:13:52.157815 IP 192.168.1.5.56822 > 167.206.252.143.443: UDP, length 42
2018-08-30 11:13:52.157924 IP 192.168.1.5.56822 > 167.206.252.143.443: UDP, length 29
2018-08-30 11:13:52.158001 IP 192.168.1.5.56822 > 167.206.252.143.443: UDP, length 29
2018-08-30 11:13:52.160847 IP 192.168.1.5.56822 > 167.206.252.143.443: UDP, length 29
2018-08-30 11:13:52.161875 IP 192.168.1.5.56822 > 167.206.252.143.443: UDP, length 29
2018-08-30 11:13:52.163013 IP 192.168.1.5.56822 > 167.206.252.143.443: UDP, length 29
2018-08-30 11:13:52.163050 IP 192.168.1.5.56822 > 167.206.252.143.443: UDP, length 29
2018-08-30 11:13:52.166569 IP 192.168.1.5.56822 > 167.206.252.143.443: UDP, length 29
2018-08-30 11:13:52.169440 IP 192.168.1.5.50288 > 172.217.11.46.443: UDP, length 888
2018-08-30 11:13:52.172417 IP 192.168.1.5.50288 > 172.217.11.46.443: UDP, length 723
2018-08-30 11:13:52.181705 IP 192.168.1.5.56822 > 167.206.252.143.443: UDP, length 29
2018-08-30 11:13:52.184297 IP 192.168.1.5.56822 > 167.206.252.143.443: UDP, length 29
2018-08-30 11:13:52.187579 IP 192.168.1.5.56822 > 167.206.252.143.443: UDP, length 29
2018-08-30 11:13:52.187744 IP 192.168.1.5.56822 > 167.206.252.143.443: UDP, length 29
2018-08-30 11:13:52.191266 IP 192.168.1.5.56822 > 167.206.252.143.443: UDP, length 29
2018-08-30 11:13:52.195275 IP 192.168.1.5.56822 > 167.206.252.143.443: UDP, length 29
2018-08-30 11:13:52.195465 IP 192.168.1.5.56822 > 167.206.252.143.443: UDP, length 29
2018-08-30 11:13:52.195659 IP 192.168.1.5.52961 > 172.217.12.206.443: UDP, length 28
2018-08-30 11:13:52.195722 IP 192.168.1.5.52961 > 172.217.12.206.443: UDP, length 28
2018-08-30 11:13:52.195805 IP 192.168.1.5.52961 > 172.217.12.206.443: UDP, length 28
2018-08-30 11:13:52.195842 IP 192.168.1.5.52961 > 172.217.12.206.443: UDP, length 28
2018-08-30 11:13:52.199154 IP 192.168.1.5.52961 > 172.217.12.206.443: UDP, length 28
2018-08-30 11:13:52.199409 IP 192.168.1.5.52961 > 172.217.12.206.443: UDP, length 28
2018-08-30 11:13:52.199410 IP 192.168.1.5.56822 > 167.206.252.143.443: UDP, length 29
2018-08-30 11:13:52.199422 IP 192.168.1.5.56822 > 167.206.252.143.443: UDP, length 29
2018-08-30 11:13:52.199532 IP 192.168.1.5.56822 > 167.206.252.143.443: UDP, length 29
2018-08-30 11:13:52.200010 IP 192.168.1.5.56822 > 167.206.252.143.443: UDP, length 29
2018-08-30 11:13:52.200098 IP 192.168.1.5.56822 > 167.206.252.143.443: UDP, length 29
2018-08-30 11:13:52.200227 IP 192.168.1.5.56822 > 167.206.252.143.443: UDP, length 42
2018-08-30 11:13:52.203367 IP 192.168.1.5.56822 > 167.206.252.143.443: UDP, length 29
2018-08-30 11:13:52.203586 IP 192.168.1.5.56822 > 167.206.252.143.443: UDP, length 29
2018-08-30 11:13:52.207530 IP 192.168.1.5.56822 > 167.206.252.143.443: UDP, length 29
2018-08-30 11:13:52.210609 IP 192.168.1.5.56822 > 167.206.252.143.443: UDP, length 29
2018-08-30 11:13:52.210706 IP 192.168.1.5.56822 > 167.206.252.143.443: UDP, length 29
2018-08-30 11:13:52.210784 IP 192.168.1.5.56822 > 167.206.252.143.443: UDP, length 29
2018-08-30 11:13:52.210993 IP 192.168.1.5.56822 > 167.206.252.143.443: UDP, length 29
2018-08-30 11:13:52.214288 IP 192.168.1.5.56822 > 167.206.252.143.443: UDP, length 29
2018-08-30 11:13:52.215045 IP 192.168.1.5.56822 > 167.206.252.143.443: UDP, length 29
2018-08-30 11:13:52.216976 IP 192.168.1.5.56822 > 167.206.252.143.443: UDP, length 29
2018-08-30 11:13:52.218705 IP 192.168.1.5.56822 > 167.206.252.143.443: UDP, length 29
2018-08-30 11:13:52.218775 IP 192.168.1.5.56822 > 167.206.252.143.443: UDP, length 29
2018-08-30 11:13:52.218917 IP 192.168.1.5.56822 > 167.206.252.143.443: UDP, length 29
2018-08-30 11:13:52.219119 IP 192.168.1.5.56822 > 167.206.252.143.443: UDP, length 29
2018-08-30 11:13:52.222873 IP 192.168.1.5.52961 > 172.217.12.206.443: UDP, length 82
2018-08-30 11:13:52.225848 IP 192.168.1.5.56822 > 167.206.252.143.443: UDP, length 29
2018-08-30 11:13:52.226806 IP 192.168.1.5.56822 > 167.206.252.143.443: UDP, length 29
2018-08-30 11:13:52.227997 IP 192.168.1.5.56822 > 167.206.252.143.443: UDP, length 29
2018-08-30 11:13:52.228880 IP 192.168.1.5.56822 > 167.206.252.143.443: UDP, length 29
2018-08-30 11:13:52.230145 IP 192.168.1.5.56822 > 167.206.252.143.443: UDP, length 29
2018-08-30 11:13:52.233671 IP 192.168.1.5.56822 > 167.206.252.143.443: UDP, length 42
2018-08-30 11:13:52.237207 IP 192.168.1.5.56822 > 167.206.252.143.443: UDP, length 29
2018-08-30 11:13:52.238451 IP 192.168.1.5.56822 > 167.206.252.143.443: UDP, length 29
2018-08-30 11:13:52.239355 IP 192.168.1.5.56822 > 167.206.252.143.443: UDP, length 29
2018-08-30 11:13:52.240513 IP 192.168.1.5.56822 > 167.206.252.143.443: UDP, length 29
2018-08-30 11:13:52.241465 IP 192.168.1.5.56822 > 167.206.252.143.443: UDP, length 29
2018-08-30 11:13:52.242902 IP 192.168.1.5.56822 > 167.206.252.143.443: UDP, length 29
2018-08-30 11:13:52.243819 IP 192.168.1.5.56822 > 167.206.252.143.443: UDP, length 29
2018-08-30 11:13:52.245031 IP 192.168.1.5.56822 > 167.206.252.143.443: UDP, length 29
2018-08-30 11:13:52.246791 IP 192.168.1.5.56822 > 167.206.252.143.443: UDP, length 29
2018-08-30 11:13:52.247851 IP 192.168.1.5.56822 > 167.206.252.143.443: UDP, length 29
2018-08-30 11:13:52.251368 IP 192.168.1.5.56822 > 167.206.252.143.443: UDP, length 29
2018-08-30 11:13:52.270342 IP 192.168.1.5.56822 > 167.206.252.143.443: UDP, length 29
2018-08-30 11:13:52.283343 IP 192.168.1.5.56822 > 167.206.252.143.443: UDP, length 29
2018-08-30 11:13:52.283578 IP 192.168.1.5.52961 > 172.217.12.206.443: UDP, length 28
2018-08-30 11:13:52.283625 IP 192.168.1.5.52961 > 172.217.12.206.443: UDP, length 28
2018-08-30 11:13:52.283702 IP 192.168.1.5.52961 > 172.217.12.206.443: UDP, length 28
2018-08-30 11:13:52.283711 IP 192.168.1.5.52961 > 172.217.12.206.443: UDP, length 28
2018-08-30 11:13:52.283757 IP 192.168.1.5.52961 > 172.217.12.206.443: UDP, length 28
2018-08-30 11:13:52.283794 IP 192.168.1.5.52961 > 172.217.12.206.443: UDP, length 28
2018-08-30 11:13:52.284244 IP 192.168.1.5.56822 > 167.206.252.143.443: UDP, length 29
2018-08-30 11:13:52.285898 IP 192.168.1.5.56822 > 167.206.252.143.443: UDP, length 29
2018-08-30 11:13:52.286696 IP 192.168.1.5.56822 > 167.206.252.143.443: UDP, length 29
2018-08-30 11:13:52.288131 IP 192.168.1.5.56822 > 167.206.252.143.443: UDP, length 29
2018-08-30 11:13:52.289699 IP 192.168.1.5.56822 > 167.206.252.143.443: UDP, length 29
2018-08-30 11:13:52.293247 IP 192.168.1.5.56822 > 167.206.252.143.443: UDP, length 29
2018-08-30 11:13:52.294844 IP 192.168.1.5.52961 > 172.217.12.206.443: UDP, length 82
2018-08-30 11:13:52.296047 IP 192.168.1.5.56822 > 167.206.252.143.443: UDP, length 42
2018-08-30 11:13:52.297551 IP 192.168.1.5.56822 > 167.206.252.143.443: UDP, length 29
2018-08-30 11:13:52.298547 IP 192.168.1.5.56822 > 167.206.252.143.443: UDP, length 29
2018-08-30 11:13:52.299675 IP 192.168.1.5.56822 > 167.206.252.143.443: UDP, length 29
2018-08-30 11:13:52.300559 IP 192.168.1.5.56822 > 167.206.252.143.443: UDP, length 29
2018-08-30 11:13:52.301708 IP 192.168.1.5.56822 > 167.206.252.143.443: UDP, length 29
2018-08-30 11:13:52.305437 IP 192.168.1.5.56822 > 167.206.252.143.443: UDP, length 29
2018-08-30 11:13:52.306922 IP 192.168.1.5.56822 > 167.206.252.143.443: UDP, length 29
2018-08-30 11:13:52.308103 IP 192.168.1.5.56822 > 167.206.252.143.443: UDP, length 29
2018-08-30 11:13:52.309049 IP 192.168.1.5.56822 > 167.206.252.143.443: UDP, length 29
2018-08-30 11:13:52.310478 IP 192.168.1.5.56822 > 167.206.252.143.443: UDP, length 29
2018-08-30 11:13:52.311290 IP 192.168.1.5.56822 > 167.206.252.143.443: UDP, length 29
2018-08-30 11:13:52.312403 IP 192.168.1.5.56822 > 167.206.252.143.443: UDP, length 29
2018-08-30 11:13:52.343950 IP 192.168.1.5.52961 > 172.217.12.206.443: UDP, length 28
2018-08-30 11:13:52.344085 IP 192.168.1.5.52961 > 172.217.12.206.443: UDP, length 28
2018-08-30 11:13:52.344117 IP 192.168.1.5.52961 > 172.217.12.206.443: UDP, length 28
2018-08-30 11:13:52.345539 IP 192.168.1.5.52961 > 172.217.12.206.443: UDP, length 28
2018-08-30 11:13:52.345587 IP 192.168.1.5.52961 > 172.217.12.206.443: UDP, length 28
2018-08-30 11:13:52.345620 IP 192.168.1.5.52961 > 172.217.12.206.443: UDP, length 28
2018-08-30 11:13:52.345725 IP 192.168.1.5.50288 > 172.217.11.46.443: UDP, length 28
2018-08-30 11:13:52.356087 IP 192.168.1.5.50288 > 172.217.11.46.443: UDP, length 28
2018-08-30 11:13:52.359657 IP 192.168.1.5.52961 > 172.217.12.206.443: UDP, length 85
2018-08-30 11:13:52.405142 IP 192.168.1.5.52961 > 172.217.12.206.443: UDP, length 28
2018-08-30 11:13:52.714879 IP 192.168.1.5.62937 > 172.217.12.206.443: UDP, length 129
2018-08-30 11:13:52.732515 IP 192.168.1.5.53734 > 172.217.7.4.443: UDP, length 1350
2018-08-30 11:13:52.732808 IP 192.168.1.5.53734 > 172.217.7.4.443: UDP, length 1005
2018-08-30 11:13:52.734192 IP 192.168.1.5.62937 > 172.217.12.206.443: UDP, length 31
2018-08-30 11:13:52.734364 IP 192.168.1.5.62937 > 172.217.12.206.443: UDP, length 31
2018-08-30 11:13:52.734398 IP 192.168.1.5.62937 > 172.217.12.206.443: UDP, length 31
2018-08-30 11:13:52.734427 IP 192.168.1.5.62937 > 172.217.12.206.443: UDP, length 31
2018-08-30 11:13:52.735575 IP 192.168.1.5.62937 > 172.217.12.206.443: UDP, length 31
2018-08-30 11:13:52.735610 IP 192.168.1.5.62937 > 172.217.12.206.443: UDP, length 31
2018-08-30 11:13:52.735642 IP 192.168.1.5.62937 > 172.217.12.206.443: UDP, length 31
2018-08-30 11:13:52.735671 IP 192.168.1.5.62937 > 172.217.12.206.443: UDP, length 31
2018-08-30 11:13:52.735700 IP 192.168.1.5.62937 > 172.217.12.206.443: UDP, length 28
2018-08-30 11:13:52.739604 IP 192.168.1.5.62937 > 172.217.12.206.443: UDP, length 29
2018-08-30 11:13:52.740679 IP 192.168.1.5.62937 > 172.217.12.206.443: UDP, length 29
2018-08-30 11:13:52.741446 IP 192.168.1.5.62937 > 172.217.12.206.443: UDP, length 29
2018-08-30 11:13:52.743261 IP 192.168.1.5.62937 > 172.217.12.206.443: UDP, length 29
2018-08-30 11:13:52.747458 IP 192.168.1.5.62937 > 172.217.12.206.443: UDP, length 29
2018-08-30 11:13:52.752107 IP 192.168.1.5.62937 > 172.217.12.206.443: UDP, length 29
2018-08-30 11:13:52.752712 IP 192.168.1.5.62937 > 172.217.12.206.443: UDP, length 29
2018-08-30 11:13:52.752932 IP 192.168.1.5.62937 > 172.217.12.206.443: UDP, length 29
2018-08-30 11:13:52.757401 IP 192.168.1.5.62937 > 172.217.12.206.443: UDP, length 29
2018-08-30 11:13:52.765715 IP 192.168.1.5.53734 > 172.217.7.4.443: UDP, length 1350
2018-08-30 11:13:52.785999 IP 192.168.1.5.53734 > 172.217.7.4.443: UDP, length 41
2018-08-30 11:13:52.786248 IP 192.168.1.5.53734 > 172.217.7.4.443: UDP, length 28
2018-08-30 11:13:52.804081 IP 192.168.1.5.53734 > 172.217.7.4.443: UDP, length 28
2018-08-30 11:13:52.804178 IP 192.168.1.5.53734 > 172.217.7.4.443: UDP, length 28
2018-08-30 11:13:52.861986 IP 192.168.1.5.53734 > 172.217.7.4.443: UDP, length 28
2018-08-30 11:13:54.302683 IP 192.168.1.5.50288 > 172.217.11.46.443: UDP, length 133
2018-08-30 11:13:54.303614 IP 192.168.1.5.56822 > 167.206.252.143.443: UDP, length 612
2018-08-30 11:13:54.327044 IP 192.168.1.5.56822 > 167.206.252.143.443: UDP, length 29
2018-08-30 11:13:54.327161 IP 192.168.1.5.56822 > 167.206.252.143.443: UDP, length 29
2018-08-30 11:13:54.328283 IP 192.168.1.5.56822 > 167.206.252.143.443: UDP, length 29
2018-08-30 11:13:54.330746 IP 192.168.1.5.56822 > 167.206.252.143.443: UDP, length 29
2018-08-30 11:13:54.331337 IP 192.168.1.5.56822 > 167.206.252.143.443: UDP, length 29
2018-08-30 11:13:54.331586 IP 192.168.1.5.56822 > 167.206.252.143.443: UDP, length 29
2018-08-30 11:13:54.335025 IP 192.168.1.5.56822 > 167.206.252.143.443: UDP, length 29
2018-08-30 11:13:54.338585 IP 192.168.1.5.56822 > 167.206.252.143.443: UDP, length 29
2018-08-30 11:13:54.339436 IP 192.168.1.5.56822 > 167.206.252.143.443: UDP, length 681
2018-08-30 11:13:54.340083 IP 192.168.1.5.56822 > 167.206.252.143.443: UDP, length 29
2018-08-30 11:13:54.340797 IP 192.168.1.5.56822 > 167.206.252.143.443: UDP, length 29
2018-08-30 11:13:54.342923 IP 192.168.1.5.56822 > 167.206.252.143.443: UDP, length 29
2018-08-30 11:13:54.346323 IP 192.168.1.5.56822 > 167.206.252.143.443: UDP, length 29
2018-08-30 11:13:54.348832 IP 192.168.1.5.56822 > 167.206.252.143.443: UDP, length 29
2018-08-30 11:13:54.351308 IP 192.168.1.5.56822 > 167.206.252.143.443: UDP, length 29
2018-08-30 11:13:54.351611 IP 192.168.1.5.56822 > 167.206.252.143.443: UDP, length 29
2018-08-30 11:13:54.354726 IP 192.168.1.5.56822 > 167.206.252.143.443: UDP, length 29
2018-08-30 11:13:54.354808 IP 192.168.1.5.56822 > 167.206.252.143.443: UDP, length 29
2018-08-30 11:13:54.358395 IP 192.168.1.5.56822 > 167.206.252.143.443: UDP, length 29
2018-08-30 11:13:54.362359 IP 192.168.1.5.56822 > 167.206.252.143.443: UDP, length 29
2018-08-30 11:13:54.362929 IP 192.168.1.5.56822 > 167.206.252.143.443: UDP, length 29
2018-08-30 11:13:54.365176 IP 192.168.1.5.56822 > 167.206.252.143.443: UDP, length 29
2018-08-30 11:13:54.365256 IP 192.168.1.5.56822 > 167.206.252.143.443: UDP, length 29
2018-08-30 11:13:54.365328 IP 192.168.1.5.56822 > 167.206.252.143.443: UDP, length 29
2018-08-30 11:13:54.365621 IP 192.168.1.5.56822 > 167.206.252.143.443: UDP, length 29
2018-08-30 11:13:54.365910 IP 192.168.1.5.56822 > 167.206.252.143.443: UDP, length 29
2018-08-30 11:13:54.365986 IP 192.168.1.5.56822 > 167.206.252.143.443: UDP, length 29
2018-08-30 11:13:54.367569 IP 192.168.1.5.56822 > 167.206.252.143.443: UDP, length 29
2018-08-30 11:13:54.371273 IP 192.168.1.5.56822 > 167.206.252.143.443: UDP, length 42
2018-08-30 11:13:54.375626 IP 192.168.1.5.56822 > 167.206.252.143.443: UDP, length 29
2018-08-30 11:13:54.375727 IP 192.168.1.5.56822 > 167.206.252.143.443: UDP, length 29
2018-08-30 11:13:54.377330 IP 192.168.1.5.56822 > 167.206.252.143.443: UDP, length 29
2018-08-30 11:13:54.380840 IP 192.168.1.5.56822 > 167.206.252.143.443: UDP, length 29
2018-08-30 11:13:54.384754 IP 192.168.1.5.56822 > 167.206.252.143.443: UDP, length 29
2018-08-30 11:13:54.385740 IP 192.168.1.5.56822 > 167.206.252.143.443: UDP, length 29
2018-08-30 11:13:54.388058 IP 192.168.1.5.56822 > 167.206.252.143.443: UDP, length 29
2018-08-30 11:13:54.391679 IP 192.168.1.5.56822 > 167.206.252.143.443: UDP, length 29
2018-08-30 11:13:54.393486 IP 192.168.1.5.56822 > 167.206.252.143.443: UDP, length 29
2018-08-30 11:13:54.393635 IP 192.168.1.5.56822 > 167.206.252.143.443: UDP, length 29
2018-08-30 11:13:54.393736 IP 192.168.1.5.56822 > 167.206.252.143.443: UDP, length 29
2018-08-30 11:13:54.393947 IP 192.168.1.5.56822 > 167.206.252.143.443: UDP, length 29
2018-08-30 11:13:54.394064 IP 192.168.1.5.56822 > 167.206.252.143.443: UDP, length 29
2018-08-30 11:13:54.395582 IP 192.168.1.5.56822 > 167.206.252.143.443: UDP, length 29
2018-08-30 11:13:54.398186 IP 192.168.1.5.56822 > 167.206.252.143.443: UDP, length 29
2018-08-30 11:13:54.399272 IP 192.168.1.5.56822 > 167.206.252.143.443: UDP, length 29
2018-08-30 11:13:54.402715 IP 192.168.1.5.56822 > 167.206.252.143.443: UDP, length 29
2018-08-30 11:13:54.402886 IP 192.168.1.5.56822 > 167.206.252.143.443: UDP, length 29
2018-08-30 11:13:54.406352 IP 192.168.1.5.56822 > 167.206.252.143.443: UDP, length 29
2018-08-30 11:13:54.408886 IP 192.168.1.5.56822 > 167.206.252.143.443: UDP, length 42
2018-08-30 11:13:54.410593 IP 192.168.1.5.56822 > 167.206.252.143.443: UDP, length 29
2018-08-30 11:13:54.416052 IP 192.168.1.5.56822 > 167.206.252.143.443: UDP, length 29
2018-08-30 11:13:54.416434 IP 192.168.1.5.56822 > 167.206.252.143.443: UDP, length 29
2018-08-30 11:13:54.416582 IP 192.168.1.5.50288 > 172.217.11.46.443: UDP, length 28
2018-08-30 11:13:54.416737 IP 192.168.1.5.50288 > 172.217.11.46.443: UDP, length 28
2018-08-30 11:13:54.420883 IP 192.168.1.5.56822 > 167.206.252.143.443: UDP, length 29
2018-08-30 11:13:54.422003 IP 192.168.1.5.56822 > 167.206.252.143.443: UDP, length 29
2018-08-30 11:13:54.422130 IP 192.168.1.5.56822 > 167.206.252.143.443: UDP, length 29
2018-08-30 11:13:54.423373 IP 192.168.1.5.56822 > 167.206.252.143.443: UDP, length 29
2018-08-30 11:13:54.426155 IP 192.168.1.5.56822 > 167.206.252.143.443: UDP, length 29
2018-08-30 11:13:54.426415 IP 192.168.1.5.56822 > 167.206.252.143.443: UDP, length 29
2018-08-30 11:13:54.426549 IP 192.168.1.5.56822 > 167.206.252.143.443: UDP, length 29
2018-08-30 11:13:54.427158 IP 192.168.1.5.56822 > 167.206.252.143.443: UDP, length 29
2018-08-30 11:13:54.427348 IP 192.168.1.5.56822 > 167.206.252.143.443: UDP, length 29
2018-08-30 11:13:54.428609 IP 192.168.1.5.56822 > 167.206.252.143.443: UDP, length 29
2018-08-30 11:13:54.429688 IP 192.168.1.5.56822 > 167.206.252.143.443: UDP, length 29
2018-08-30 11:13:54.430675 IP 192.168.1.5.56822 > 167.206.252.143.443: UDP, length 29
2018-08-30 11:13:54.436160 IP 192.168.1.5.56822 > 167.206.252.143.443: UDP, length 29
2018-08-30 11:13:54.436403 IP 192.168.1.5.56822 > 167.206.252.143.443: UDP, length 29
2018-08-30 11:13:54.436648 IP 192.168.1.5.56822 > 167.206.252.143.443: UDP, length 29
2018-08-30 11:13:54.439027 IP 192.168.1.5.56822 > 167.206.252.143.443: UDP, length 29
2018-08-30 11:13:54.439153 IP 192.168.1.5.56822 > 167.206.252.143.443: UDP, length 42
2018-08-30 11:13:54.441833 IP 192.168.1.5.56822 > 167.206.252.143.443: UDP, length 29
2018-08-30 11:13:54.441914 IP 192.168.1.5.56822 > 167.206.252.143.443: UDP, length 29
2018-08-30 11:13:54.442007 IP 192.168.1.5.56822 > 167.206.252.143.443: UDP, length 29
2018-08-30 11:13:54.442145 IP 192.168.1.5.50288 > 172.217.11.46.443: UDP, length 28
2018-08-30 11:13:54.444334 IP 192.168.1.5.56822 > 167.206.252.143.443: UDP, length 29
2018-08-30 11:13:54.444461 IP 192.168.1.5.56822 > 167.206.252.143.443: UDP, length 29
2018-08-30 11:13:54.444607 IP 192.168.1.5.56822 > 167.206.252.143.443: UDP, length 29
2018-08-30 11:13:54.446817 IP 192.168.1.5.56822 > 167.206.252.143.443: UDP, length 29
2018-08-30 11:13:54.451598 IP 192.168.1.5.56822 > 167.206.252.143.443: UDP, length 29
2018-08-30 11:13:54.452982 IP 192.168.1.5.56822 > 167.206.252.143.443: UDP, length 29
2018-08-30 11:13:54.453097 IP 192.168.1.5.56822 > 167.206.252.143.443: UDP, length 29
2018-08-30 11:13:54.456097 IP 192.168.1.5.56822 > 167.206.252.143.443: UDP, length 29
2018-08-30 11:13:54.456237 IP 192.168.1.5.56822 > 167.206.252.143.443: UDP, length 30
2018-08-30 11:13:54.456431 IP 192.168.1.5.56822 > 167.206.252.143.443: UDP, length 30
2018-08-30 11:13:54.457223 IP 192.168.1.5.56822 > 167.206.252.143.443: UDP, length 30
2018-08-30 11:13:54.460353 IP 192.168.1.5.56822 > 167.206.252.143.443: UDP, length 30
2018-08-30 11:13:54.460487 IP 192.168.1.5.56822 > 167.206.252.143.443: UDP, length 30
2018-08-30 11:13:54.462415 IP 192.168.1.5.56822 > 167.206.252.143.443: UDP, length 30
2018-08-30 11:13:54.463213 IP 192.168.1.5.56822 > 167.206.252.143.443: UDP, length 30
2018-08-30 11:13:54.465839 IP 192.168.1.5.56822 > 167.206.252.143.443: UDP, length 30
2018-08-30 11:13:54.467828 IP 192.168.1.5.50288 > 172.217.11.46.443: UDP, length 523
2018-08-30 11:13:54.469091 IP 192.168.1.5.56822 > 167.206.252.143.443: UDP, length 43
2018-08-30 11:13:54.470468 IP 192.168.1.5.56822 > 167.206.252.143.443: UDP, length 30
2018-08-30 11:13:54.471669 IP 192.168.1.5.56822 > 167.206.252.143.443: UDP, length 29
2018-08-30 11:13:54.474908 IP 192.168.1.5.56822 > 167.206.252.143.443: UDP, length 29
2018-08-30 11:13:54.475954 IP 192.168.1.5.56822 > 167.206.252.143.443: UDP, length 29
2018-08-30 11:13:54.476908 IP 192.168.1.5.56822 > 167.206.252.143.443: UDP, length 29
2018-08-30 11:13:54.480800 IP 192.168.1.5.56822 > 167.206.252.143.443: UDP, length 29
2018-08-30 11:13:54.481980 IP 192.168.1.5.56822 > 167.206.252.143.443: UDP, length 29
2018-08-30 11:13:54.485684 IP 192.168.1.5.56822 > 167.206.252.143.443: UDP, length 29
2018-08-30 11:13:54.493873 IP 192.168.1.5.56822 > 167.206.252.143.443: UDP, length 29
2018-08-30 11:13:54.496400 IP 192.168.1.5.56822 > 167.206.252.143.443: UDP, length 29
2018-08-30 11:13:54.500053 IP 192.168.1.5.56822 > 167.206.252.143.443: UDP, length 29
2018-08-30 11:13:54.501401 IP 192.168.1.5.56822 > 167.206.252.143.443: UDP, length 29
2018-08-30 11:13:54.502489 IP 192.168.1.5.56822 > 167.206.252.143.443: UDP, length 29
2018-08-30 11:13:54.502725 IP 192.168.1.5.56822 > 167.206.252.143.443: UDP, length 29
2018-08-30 11:13:54.504624 IP 192.168.1.5.56822 > 167.206.252.143.443: UDP, length 29
2018-08-30 11:13:54.509277 IP 192.168.1.5.56822 > 167.206.252.143.443: UDP, length 29
2018-08-30 11:13:54.509347 IP 192.168.1.5.56822 > 167.206.252.143.443: UDP, length 29
2018-08-30 11:13:54.509407 IP 192.168.1.5.56822 > 167.206.252.143.443: UDP, length 29
2018-08-30 11:13:54.509568 IP 192.168.1.5.56822 > 167.206.252.143.443: UDP, length 29
2018-08-30 11:13:54.512894 IP 192.168.1.5.56822 > 167.206.252.143.443: UDP, length 42
2018-08-30 11:13:54.513421 IP 192.168.1.5.56822 > 167.206.252.143.443: UDP, length 29
2018-08-30 11:13:54.513491 IP 192.168.1.5.56822 > 167.206.252.143.443: UDP, length 29
2018-08-30 11:13:54.517184 IP 192.168.1.5.56822 > 167.206.252.143.443: UDP, length 29
2018-08-30 11:13:54.517309 IP 192.168.1.5.56822 > 167.206.252.143.443: UDP, length 29
2018-08-30 11:13:54.521571 IP 192.168.1.5.56822 > 167.206.252.143.443: UDP, length 29
2018-08-30 11:13:54.521663 IP 192.168.1.5.56822 > 167.206.252.143.443: UDP, length 29
2018-08-30 11:13:54.521732 IP 192.168.1.5.56822 > 167.206.252.143.443: UDP, length 29
2018-08-30 11:13:54.521893 IP 192.168.1.5.56822 > 167.206.252.143.443: UDP, length 29
2018-08-30 11:13:54.525285 IP 192.168.1.5.56822 > 167.206.252.143.443: UDP, length 29
2018-08-30 11:13:54.526410 IP 192.168.1.5.56822 > 167.206.252.143.443: UDP, length 29
2018-08-30 11:13:54.529079 IP 192.168.1.5.56822 > 167.206.252.143.443: UDP, length 29
2018-08-30 11:13:54.529159 IP 192.168.1.5.56822 > 167.206.252.143.443: UDP, length 29
2018-08-30 11:13:54.529288 IP 192.168.1.5.56822 > 167.206.252.143.443: UDP, length 29
2018-08-30 11:13:54.529399 IP 192.168.1.5.56822 > 167.206.252.143.443: UDP, length 29
2018-08-30 11:13:54.529599 IP 192.168.1.5.56822 > 167.206.252.143.443: UDP, length 29
2018-08-30 11:13:54.529899 IP 192.168.1.5.56822 > 167.206.252.143.443: UDP, length 29
2018-08-30 11:13:54.530725 IP 192.168.1.5.56822 > 167.206.252.143.443: UDP, length 29
2018-08-30 11:13:54.534062 IP 192.168.1.5.56822 > 167.206.252.143.443: UDP, length 29
2018-08-30 11:13:54.534642 IP 192.168.1.5.56822 > 167.206.252.143.443: UDP, length 30
2018-08-30 11:13:54.535847 IP 192.168.1.5.56822 > 167.206.252.143.443: UDP, length 42
2018-08-30 11:13:54.537622 IP 192.168.1.5.56822 > 167.206.252.143.443: UDP, length 30
2018-08-30 11:13:54.537753 IP 192.168.1.5.56822 > 167.206.252.143.443: UDP, length 30
2018-08-30 11:13:54.538929 IP 192.168.1.5.56822 > 167.206.252.143.443: UDP, length 29
2018-08-30 11:13:54.541306 IP 192.168.1.5.56822 > 167.206.252.143.443: UDP, length 29
2018-08-30 11:13:54.542874 IP 192.168.1.5.56822 > 167.206.252.143.443: UDP, length 29
2018-08-30 11:13:54.546604 IP 192.168.1.5.56822 > 167.206.252.143.443: UDP, length 29
2018-08-30 11:13:54.547736 IP 192.168.1.5.56822 > 167.206.252.143.443: UDP, length 29
2018-08-30 11:13:54.549011 IP 192.168.1.5.56822 > 167.206.252.143.443: UDP, length 29
2018-08-30 11:13:54.549926 IP 192.168.1.5.56822 > 167.206.252.143.443: UDP, length 29
2018-08-30 11:13:54.551335 IP 192.168.1.5.56822 > 167.206.252.143.443: UDP, length 29
2018-08-30 11:13:54.555779 IP 192.168.1.5.56822 > 167.206.252.143.443: UDP, length 30
2018-08-30 11:13:54.558332 IP 192.168.1.5.56822 > 167.206.252.143.443: UDP, length 29
2018-08-30 11:13:54.558399 IP 192.168.1.5.56822 > 167.206.252.143.443: UDP, length 29
2018-08-30 11:13:54.558464 IP 192.168.1.5.56822 > 167.206.252.143.443: UDP, length 29
2018-08-30 11:13:54.558526 IP 192.168.1.5.56822 > 167.206.252.143.443: UDP, length 30
2018-08-30 11:13:54.558842 IP 192.168.1.5.56822 > 167.206.252.143.443: UDP, length 30
2018-08-30 11:13:54.561498 IP 192.168.1.5.56822 > 167.206.252.143.443: UDP, length 29
2018-08-30 11:13:54.561598 IP 192.168.1.5.56822 > 167.206.252.143.443: UDP, length 29
2018-08-30 11:13:54.562740 IP 192.168.1.5.56822 > 167.206.252.143.443: UDP, length 29
2018-08-30 11:13:54.563642 IP 192.168.1.5.56822 > 167.206.252.143.443: UDP, length 42
2018-08-30 11:13:54.565220 IP 192.168.1.5.56822 > 167.206.252.143.443: UDP, length 29
2018-08-30 11:13:54.565477 IP 192.168.1.5.56822 > 167.206.252.143.443: UDP, length 29
2018-08-30 11:13:54.569077 IP 192.168.1.5.56822 > 167.206.252.143.443: UDP, length 29
2018-08-30 11:13:54.574573 IP 192.168.1.5.56822 > 167.206.252.143.443: UDP, length 29
2018-08-30 11:13:54.575775 IP 192.168.1.5.56822 > 167.206.252.143.443: UDP, length 30
2018-08-30 11:13:54.576962 IP 192.168.1.5.56822 > 167.206.252.143.443: UDP, length 29
2018-08-30 11:13:54.578393 IP 192.168.1.5.56822 > 167.206.252.143.443: UDP, length 29
2018-08-30 11:13:54.578488 IP 192.168.1.5.56822 > 167.206.252.143.443: UDP, length 29
2018-08-30 11:13:54.578597 IP 192.168.1.5.56822 > 167.206.252.143.443: UDP, length 30
2018-08-30 11:13:54.581083 IP 192.168.1.5.56822 > 167.206.252.143.443: UDP, length 30
2018-08-30 11:13:54.582112 IP 192.168.1.5.56822 > 167.206.252.143.443: UDP, length 30
2018-08-30 11:13:54.582216 IP 192.168.1.5.56822 > 167.206.252.143.443: UDP, length 30
2018-08-30 11:13:54.582285 IP 192.168.1.5.56822 > 167.206.252.143.443: UDP, length 30
2018-08-30 11:13:54.585805 IP 192.168.1.5.56822 > 167.206.252.143.443: UDP, length 30
2018-08-30 11:13:54.593010 IP 192.168.1.5.56822 > 167.206.252.143.443: UDP, length 30
2018-08-30 11:13:54.593158 IP 192.168.1.5.56822 > 167.206.252.143.443: UDP, length 30
2018-08-30 11:13:54.593323 IP 192.168.1.5.56822 > 167.206.252.143.443: UDP, length 30
2018-08-30 11:13:54.593614 IP 192.168.1.5.56822 > 167.206.252.143.443: UDP, length 30
2018-08-30 11:13:54.593765 IP 192.168.1.5.56822 > 167.206.252.143.443: UDP, length 30
2018-08-30 11:13:54.594003 IP 192.168.1.5.56822 > 167.206.252.143.443: UDP, length 43
2018-08-30 11:13:54.597862 IP 192.168.1.5.56822 > 167.206.252.143.443: UDP, length 30
2018-08-30 11:13:54.598193 IP 192.168.1.5.56822 > 167.206.252.143.443: UDP, length 30
2018-08-30 11:13:54.598262 IP 192.168.1.5.56822 > 167.206.252.143.443: UDP, length 30
2018-08-30 11:13:54.598333 IP 192.168.1.5.56822 > 167.206.252.143.443: UDP, length 30
2018-08-30 11:13:54.598714 IP 192.168.1.5.56822 > 167.206.252.143.443: UDP, length 30
2018-08-30 11:13:54.616936 IP 192.168.1.5.56822 > 167.206.252.143.443: UDP, length 30
2018-08-30 11:13:54.617149 IP 192.168.1.5.56822 > 167.206.252.143.443: UDP, length 30
2018-08-30 11:13:54.620216 IP 192.168.1.5.56822 > 167.206.252.143.443: UDP, length 30
2018-08-30 11:13:54.623933 IP 192.168.1.5.56822 > 167.206.252.143.443: UDP, length 29
2018-08-30 11:13:54.631440 IP 192.168.1.5.56822 > 167.206.252.143.443: UDP, length 29
2018-08-30 11:13:54.633867 IP 192.168.1.5.56822 > 167.206.252.143.443: UDP, length 29
2018-08-30 11:13:54.634034 IP 192.168.1.5.56822 > 167.206.252.143.443: UDP, length 29
2018-08-30 11:13:54.634172 IP 192.168.1.5.56822 > 167.206.252.143.443: UDP, length 29
2018-08-30 11:13:54.637489 IP 192.168.1.5.56822 > 167.206.252.143.443: UDP, length 29
2018-08-30 11:13:54.640907 IP 192.168.1.5.56822 > 167.206.252.143.443: UDP, length 29
2018-08-30 11:13:54.642326 IP 192.168.1.5.56822 > 167.206.252.143.443: UDP, length 29
2018-08-30 11:13:54.642382 IP 192.168.1.5.56822 > 167.206.252.143.443: UDP, length 29
2018-08-30 11:13:54.643839 IP 192.168.1.5.50288 > 172.217.11.46.443: UDP, length 28
2018-08-30 11:13:54.643873 IP 192.168.1.5.56822 > 167.206.252.143.443: UDP, length 29
2018-08-30 11:13:54.647313 IP 192.168.1.5.56822 > 167.206.252.143.443: UDP, length 29
2018-08-30 11:13:55.275784 IP 192.168.1.5.50288 > 172.217.11.46.443: UDP, length 1350
2018-08-30 11:13:55.276744 IP 192.168.1.5.50288 > 172.217.11.46.443: UDP, length 522
2018-08-30 11:13:55.320458 IP 192.168.1.5.50288 > 172.217.11.46.443: UDP, length 28
