2018-08-30 11:12:14.786139 IP 192.168.1.5.61995 > 104.25.148.25.80: Flags [S], seq 4031056664, win 65535, options [mss 1460,nop,wscale 5,nop,nop,TS val 384784285 ecr 0,sackOK,eol], length 0
2018-08-30 11:12:14.812239 IP 192.168.1.5.61995 > 104.25.148.25.80: Flags [.], ack 2282419907, win 8192, length 0
2018-08-30 11:12:14.814421 IP 192.168.1.5.61995 > 104.25.148.25.80: Flags [P.], seq 0:354, ack 1, win 8192, length 354: HTTP: GET /shutdown HTTP/1.1
2018-08-30 11:12:14.838633 IP 192.168.1.5.61995 > 104.25.148.25.80: Flags [.], ack 571, win 8174, length 0
2018-08-30 11:12:14.838946 IP 192.168.1.5.61995 > 104.25.148.25.80: Flags [.], ack 962, win 8179, length 0
2018-08-30 11:12:14.838947 IP 192.168.1.5.61995 > 104.25.148.25.80: Flags [.], ack 982, win 8179, length 0
2018-08-30 11:12:16.257031 IP 192.168.1.5.57969 > 172.217.7.4.443: UDP, length 1350
2018-08-30 11:12:16.258115 IP 192.168.1.5.57969 > 172.217.7.4.443: UDP, length 1164
2018-08-30 11:12:16.294636 IP 192.168.1.5.57969 > 172.217.7.4.443: UDP, length 1350
2018-08-30 11:12:16.296365 IP 192.168.1.5.57969 > 172.217.7.4.443: UDP, length 28
2018-08-30 11:12:16.299717 IP 192.168.1.5.57969 > 172.217.7.4.443: UDP, length 1350
2018-08-30 11:12:16.299761 IP 192.168.1.5.57969 > 172.217.7.4.443: UDP, length 1160
2018-08-30 11:12:16.356992 IP 192.168.1.5.57969 > 172.217.7.4.443: UDP, length 41
2018-08-30 11:12:16.357104 IP 192.168.1.5.57969 > 172.217.7.4.443: UDP, length 28
2018-08-30 11:12:16.370758 IP 192.168.1.5.57969 > 172.217.7.4.443: UDP, length 1160
2018-08-30 11:12:16.477419 IP 192.168.1.5.57969 > 172.217.7.4.443: UDP, length 159
2018-08-30 11:12:16.497754 IP 192.168.1.5.57969 > 172.217.7.4.443: UDP, length 1166
2018-08-30 11:12:16.543199 IP 192.168.1.5.57969 > 172.217.7.4.443: UDP, length 28
2018-08-30 11:12:16.619395 IP 192.168.1.5.57969 > 172.217.7.4.443: UDP, length 28
2018-08-30 11:12:16.620157 IP 192.168.1.5.57969 > 172.217.7.4.443: UDP, length 28
2018-08-30 11:12:16.620197 IP 192.168.1.5.57969 > 172.217.7.4.443: UDP, length 28
2018-08-30 11:12:16.620604 IP 192.168.1.5.57969 > 172.217.7.4.443: UDP, length 28
2018-08-30 11:12:16.620611 IP 192.168.1.5.57969 > 172.217.7.4.443: UDP, length 28
2018-08-30 11:12:16.622158 IP 192.168.1.5.57969 > 172.217.7.4.443: UDP, length 28
2018-08-30 11:12:16.622210 IP 192.168.1.5.57969 > 172.217.7.4.443: UDP, length 28
2018-08-30 11:12:16.622252 IP 192.168.1.5.57969 > 172.217.7.4.443: UDP, length 28
2018-08-30 11:12:16.625085 IP 192.168.1.5.57969 > 172.217.7.4.443: UDP, length 28
2018-08-30 11:12:16.626371 IP 192.168.1.5.57969 > 172.217.7.4.443: UDP, length 28
2018-08-30 11:12:16.629625 IP 192.168.1.5.57969 > 172.217.7.4.443: UDP, length 28
2018-08-30 11:12:16.629757 IP 192.168.1.5.57969 > 172.217.7.4.443: UDP, length 28
2018-08-30 11:12:16.630014 IP 192.168.1.5.57969 > 172.217.7.4.443: UDP, length 28
2018-08-30 11:12:16.630099 IP 192.168.1.5.57969 > 172.217.7.4.443: UDP, length 28
2018-08-30 11:12:16.630881 IP 192.168.1.5.57969 > 172.217.7.4.443: UDP, length 28
2018-08-30 11:12:16.630958 IP 192.168.1.5.57969 > 172.217.7.4.443: UDP, length 28
2018-08-30 11:12:16.630967 IP 192.168.1.5.57969 > 172.217.7.4.443: UDP, length 28
2018-08-30 11:12:16.632243 IP 192.168.1.5.57969 > 172.217.7.4.443: UDP, length 28
2018-08-30 11:12:16.633048 IP 192.168.1.5.57969 > 172.217.7.4.443: UDP, length 41
2018-08-30 11:12:16.633661 IP 192.168.1.5.57969 > 172.217.7.4.443: UDP, length 28
2018-08-30 11:12:16.634739 IP 192.168.1.5.57969 > 172.217.7.4.443: UDP, length 28
2018-08-30 11:12:16.638983 IP 192.168.1.5.57969 > 172.217.7.4.443: UDP, length 28
2018-08-30 11:12:16.640832 IP 192.168.1.5.57969 > 172.217.7.4.443: UDP, length 28
2018-08-30 11:12:16.641019 IP 192.168.1.5.57969 > 172.217.7.4.443: UDP, length 28
2018-08-30 11:12:16.642879 IP 192.168.1.5.57969 > 172.217.7.4.443: UDP, length 28
2018-08-30 11:12:16.643081 IP 192.168.1.5.57969 > 172.217.7.4.443: UDP, length 28
2018-08-30 11:12:16.643230 IP 192.168.1.5.57969 > 172.217.7.4.443: UDP, length 28
2018-08-30 11:12:17.043886 IP 192.168.1.5.57969 > 172.217.7.4.443: UDP, length 255
2018-08-30 11:12:17.185099 IP 192.168.1.5.57969 > 172.217.7.4.443: UDP, length 255
2018-08-30 11:12:17.247209 IP 192.168.1.5.57969 > 172.217.7.4.443: UDP, length 28
2018-08-30 11:12:17.279074 IP 192.168.1.5.57969 > 172.217.7.4.443: UDP, length 222
2018-08-30 11:12:17.310334 IP 192.168.1.5.57969 > 172.217.7.4.443: UDP, length 28
2018-08-30 11:12:17.335498 IP 192.168.1.5.57969 > 172.217.7.4.443: UDP, length 28
2018-08-30 11:12:17.382307 IP 192.168.1.5.58662 > 172.217.12.206.443: UDP, length 1350
2018-08-30 11:12:17.417807 IP 192.168.1.5.58662 > 172.217.12.206.443: UDP, length 28
2018-08-30 11:12:17.422027 IP 192.168.1.5.58662 > 172.217.12.206.443: UDP, length 1350
2018-08-30 11:12:17.458281 IP 192.168.1.5.58662 > 172.217.12.206.443: UDP, length 39
2018-08-30 11:12:17.458388 IP 192.168.1.5.58662 > 172.217.12.206.443: UDP, length 28
2018-08-30 11:12:17.458719 IP 192.168.1.5.58662 > 172.217.12.206.443: UDP, length 1123
2018-08-30 11:12:17.583548 IP 192.168.1.5.58662 > 172.217.12.206.443: UDP, length 28
2018-08-30 11:12:17.674478 IP 192.168.1.5.57969 > 172.217.7.4.443: UDP, length 146
2018-08-30 11:12:17.783561 IP 192.168.1.5.57969 > 172.217.7.4.443: UDP, length 28
2018-08-30 11:12:17.783613 IP 192.168.1.5.57969 > 172.217.7.4.443: UDP, length 28
2018-08-30 11:12:17.783655 IP 192.168.1.5.57969 > 172.217.7.4.443: UDP, length 28
2018-08-30 11:12:17.784312 IP 192.168.1.5.57969 > 172.217.7.4.443: UDP, length 28
2018-08-30 11:12:17.784430 IP 192.168.1.5.57969 > 172.217.7.4.443: UDP, length 28
2018-08-30 11:12:17.784472 IP 192.168.1.5.57969 > 172.217.7.4.443: UDP, length 28
2018-08-30 11:12:17.785473 IP 192.168.1.5.57969 > 172.217.7.4.443: UDP, length 28
2018-08-30 11:12:17.785520 IP 192.168.1.5.57969 > 172.217.7.4.443: UDP, length 28
2018-08-30 11:12:17.785591 IP 192.168.1.5.57969 > 172.217.7.4.443: UDP, length 28
2018-08-30 11:12:17.788153 IP 192.168.1.5.57969 > 172.217.7.4.443: UDP, length 28
2018-08-30 11:12:17.788208 IP 192.168.1.5.57969 > 172.217.7.4.443: UDP, length 28
2018-08-30 11:12:17.788303 IP 192.168.1.5.57969 > 172.217.7.4.443: UDP, length 28
2018-08-30 11:12:17.788310 IP 192.168.1.5.57969 > 172.217.7.4.443: UDP, length 28
2018-08-30 11:12:17.789995 IP 192.168.1.5.57969 > 172.217.7.4.443: UDP, length 28
2018-08-30 11:12:17.793052 IP 192.168.1.5.57969 > 172.217.7.4.443: UDP, length 28
2018-08-30 11:12:17.796728 IP 192.168.1.5.57969 > 172.217.7.4.443: UDP, length 28
2018-08-30 11:12:17.806660 IP 192.168.1.5.57969 > 172.217.7.4.443: UDP, length 28
2018-08-30 11:12:17.811460 IP 192.168.1.5.57969 > 172.217.7.4.443: UDP, length 28
2018-08-30 11:12:18.064809 IP 192.168.1.5.57969 > 172.217.7.4.443: UDP, length 240
2018-08-30 11:12:18.118787 IP 192.168.1.5.57969 > 172.217.7.4.443: UDP, length 28
2018-08-30 11:12:18.210470 IP 192.168.1.5.57969 > 172.217.7.4.443: UDP, length 171
2018-08-30 11:12:18.261061 IP 192.168.1.5.58662 > 172.217.12.206.443: UDP, length 264
2018-08-30 11:12:18.345207 IP 192.168.1.5.57969 > 172.217.7.4.443: UDP, length 171
2018-08-30 11:12:18.374830 IP 192.168.1.5.58662 > 172.217.12.206.443: UDP, length 28
2018-08-30 11:12:18.380304 IP 192.168.1.5.57969 > 172.217.7.4.443: UDP, length 28
2018-08-30 11:12:18.858073 IP 192.168.1.5.62012 > 151.101.65.69.443: Flags [S], seq 1204688796, win 65535, options [mss 1460,nop,wscale 5,nop,nop,TS val 384788344 ecr 0,sackOK,eol], length 0
2018-08-30 11:12:18.886845 IP 192.168.1.5.62012 > 151.101.65.69.443: Flags [.], ack 3716987068, win 4108, options [nop,nop,TS val 384788372 ecr 570281059], length 0
2018-08-30 11:12:18.887055 IP 192.168.1.5.62012 > 151.101.65.69.443: Flags [P.], seq 0:517, ack 1, win 4108, options [nop,nop,TS val 384788372 ecr 570281059], length 517
2018-08-30 11:12:18.913636 IP 192.168.1.5.62012 > 151.101.65.69.443: Flags [.], ack 2769, win 4052, options [nop,nop,TS val 384788397 ecr 570281065], length 0
2018-08-30 11:12:18.913636 IP 192.168.1.5.62012 > 151.101.65.69.443: Flags [.], ack 3935, win 4016, options [nop,nop,TS val 384788397 ecr 570281065], length 0
2018-08-30 11:12:18.914093 IP 192.168.1.5.62012 > 151.101.65.69.443: Flags [P.], seq 517:610, ack 3935, win 4096, options [nop,nop,TS val 384788397 ecr 570281065], length 93
2018-08-30 11:12:18.919212 IP 192.168.1.5.62012 > 151.101.65.69.443: Flags [P.], seq 610:703, ack 3935, win 4096, options [nop,nop,TS val 384788402 ecr 570281065], length 93
2018-08-30 11:12:18.919459 IP 192.168.1.5.62012 > 151.101.65.69.443: Flags [P.], seq 703:1260, ack 3935, win 4096, options [nop,nop,TS val 384788402 ecr 570281065], length 557
2018-08-30 11:12:18.937330 IP 192.168.1.5.62012 > 151.101.65.69.443: Flags [.], ack 4193, win 4087, options [nop,nop,TS val 384788420 ecr 570281071], length 0
2018-08-30 11:12:18.940780 IP 192.168.1.5.62012 > 151.101.65.69.443: Flags [.], ack 4259, win 4093, options [nop,nop,TS val 384788422 ecr 570281073], length 0
2018-08-30 11:12:18.940952 IP 192.168.1.5.62012 > 151.101.65.69.443: Flags [P.], seq 1260:1298, ack 4259, win 4096, options [nop,nop,TS val 384788422 ecr 570281073], length 38
2018-08-30 11:12:18.977815 IP 192.168.1.5.62012 > 151.101.65.69.443: Flags [.], ack 7027, win 4052, options [nop,nop,TS val 384788457 ecr 570281078], length 0
2018-08-30 11:12:18.977816 IP 192.168.1.5.62012 > 151.101.65.69.443: Flags [.], ack 7047, win 4052, options [nop,nop,TS val 384788457 ecr 570281078], length 0
2018-08-30 11:12:18.977816 IP 192.168.1.5.62012 > 151.101.65.69.443: Flags [.], ack 9815, win 3965, options [nop,nop,TS val 384788457 ecr 570281078], length 0
2018-08-30 11:12:18.977850 IP 192.168.1.5.62012 > 151.101.65.69.443: Flags [.], ack 9815, win 4096, options [nop,nop,TS val 384788457 ecr 570281078], length 0
2018-08-30 11:12:18.977944 IP 192.168.1.5.62012 > 151.101.65.69.443: Flags [.], ack 9835, win 4095, options [nop,nop,TS val 384788457 ecr 570281078], length 0
2018-08-30 11:12:18.977945 IP 192.168.1.5.62012 > 151.101.65.69.443: Flags [.], ack 11032, win 4057, options [nop,nop,TS val 384788457 ecr 570281078], length 0
2018-08-30 11:12:18.978213 IP 192.168.1.5.62012 > 151.101.65.69.443: Flags [.], ack 13800, win 4052, options [nop,nop,TS val 384788458 ecr 570281078], length 0
2018-08-30 11:12:18.978214 IP 192.168.1.5.62012 > 151.101.65.69.443: Flags [.], ack 13820, win 4095, options [nop,nop,TS val 384788458 ecr 570281078], length 0
2018-08-30 11:12:18.992574 IP 192.168.1.5.62012 > 151.101.65.69.443: Flags [.], ack 16588, win 4009, options [nop,nop,TS val 384788472 ecr 570281086], length 0
2018-08-30 11:12:18.992712 IP 192.168.1.5.62012 > 151.101.65.69.443: Flags [.], ack 17972, win 4096, options [nop,nop,TS val 384788472 ecr 570281086], length 0
2018-08-30 11:12:18.993706 IP 192.168.1.5.62012 > 151.101.65.69.443: Flags [.], ack 20740, win 4009, options [nop,nop,TS val 384788473 ecr 570281086], length 0
2018-08-30 11:12:18.993706 IP 192.168.1.5.62012 > 151.101.65.69.443: Flags [.], ack 23508, win 3923, options [nop,nop,TS val 384788473 ecr 570281086], length 0
2018-08-30 11:12:18.993707 IP 192.168.1.5.62012 > 151.101.65.69.443: Flags [.], ack 26276, win 3836, options [nop,nop,TS val 384788473 ecr 570281086], length 0
2018-08-30 11:12:18.994162 IP 192.168.1.5.62012 > 151.101.65.69.443: Flags [.], ack 27660, win 4096, options [nop,nop,TS val 384788473 ecr 570281086], length 0
2018-08-30 11:12:18.997814 IP 192.168.1.5.62012 > 151.101.65.69.443: Flags [.], ack 30428, win 4052, options [nop,nop,TS val 384788476 ecr 570281087], length 0
2018-08-30 11:12:18.997840 IP 192.168.1.5.62012 > 151.101.65.69.443: Flags [.], ack 33196, win 4009, options [nop,nop,TS val 384788476 ecr 570281087], length 0
2018-08-30 11:12:18.997840 IP 192.168.1.5.62012 > 151.101.65.69.443: Flags [.], ack 33196, win 4096, options [nop,nop,TS val 384788476 ecr 570281087], length 0
2018-08-30 11:12:18.997970 IP 192.168.1.5.62012 > 151.101.65.69.443: Flags [.], ack 35964, win 4009, options [nop,nop,TS val 384788476 ecr 570281087], length 0
2018-08-30 11:12:18.997971 IP 192.168.1.5.62012 > 151.101.65.69.443: Flags [.], ack 35964, win 4096, options [nop,nop,TS val 384788476 ecr 570281087], length 0
2018-08-30 11:12:19.000660 IP 192.168.1.5.62012 > 151.101.65.69.443: Flags [.], ack 38732, win 4052, options [nop,nop,TS val 384788479 ecr 570281087], length 0
2018-08-30 11:12:19.000661 IP 192.168.1.5.62012 > 151.101.65.69.443: Flags [.], ack 41500, win 3966, options [nop,nop,TS val 384788479 ecr 570281087], length 0
2018-08-30 11:12:19.000661 IP 192.168.1.5.62012 > 151.101.65.69.443: Flags [.], ack 41500, win 4096, options [nop,nop,TS val 384788479 ecr 570281087], length 0
2018-08-30 11:12:19.007927 IP 192.168.1.5.62012 > 151.101.65.69.443: Flags [.], ack 44268, win 4052, options [nop,nop,TS val 384788486 ecr 570281090], length 0
2018-08-30 11:12:19.007928 IP 192.168.1.5.62012 > 151.101.65.69.443: Flags [.], ack 47036, win 3966, options [nop,nop,TS val 384788486 ecr 570281090], length 0
2018-08-30 11:12:19.008014 IP 192.168.1.5.62012 > 151.101.65.69.443: Flags [.], ack 47036, win 4096, options [nop,nop,TS val 384788486 ecr 570281090], length 0
2018-08-30 11:12:19.008152 IP 192.168.1.5.62012 > 151.101.65.69.443: Flags [.], ack 49804, win 4052, options [nop,nop,TS val 384788486 ecr 570281090], length 0
2018-08-30 11:12:19.008159 IP 192.168.1.5.62012 > 151.101.65.69.443: Flags [.], ack 50347, win 4035, options [nop,nop,TS val 384788486 ecr 570281090], length 0
2018-08-30 11:12:19.097422 IP 192.168.1.5.62017 > 192.0.73.2.443: Flags [S], seq 529822740, win 65535, options [mss 1460,nop,wscale 5,nop,nop,TS val 384788575 ecr 0,sackOK,eol], length 0
2018-08-30 11:12:19.116479 IP 192.168.1.5.62017 > 192.0.73.2.443: Flags [.], ack 3334029905, win 8192, length 0
2018-08-30 11:12:19.118662 IP 192.168.1.5.62017 > 192.0.73.2.443: Flags [P.], seq 0:517, ack 1, win 8192, length 517
2018-08-30 11:12:19.141661 IP 192.168.1.5.62017 > 192.0.73.2.443: Flags [.], ack 2921, win 8100, length 0
2018-08-30 11:12:19.141662 IP 192.168.1.5.62017 > 192.0.73.2.443: Flags [.], ack 4097, win 8064, length 0
2018-08-30 11:12:19.142879 IP 192.168.1.5.62017 > 192.0.73.2.443: Flags [.], ack 6056, win 8002, length 0
2018-08-30 11:12:19.144825 IP 192.168.1.5.62017 > 192.0.73.2.443: Flags [.], ack 6056, win 8192, length 0
2018-08-30 11:12:19.146316 IP 192.168.1.5.62017 > 192.0.73.2.443: Flags [P.], seq 517:581, ack 6056, win 8192, length 64
2018-08-30 11:12:19.163750 IP 192.168.1.5.62017 > 192.0.73.2.443: Flags [.], ack 6327, win 8183, length 0
2018-08-30 11:12:19.163947 IP 192.168.1.5.62017 > 192.0.73.2.443: Flags [.], ack 6598, win 8175, length 0
2018-08-30 11:12:19.163985 IP 192.168.1.5.62017 > 192.0.73.2.443: Flags [.], ack 6660, win 8173, length 0
2018-08-30 11:12:19.207639 IP 192.168.1.5.62017 > 192.0.73.2.443: Flags [P.], seq 581:667, ack 6660, win 8173, length 86
2018-08-30 11:12:19.208031 IP 192.168.1.5.62017 > 192.0.73.2.443: Flags [P.], seq 667:698, ack 6660, win 8192, length 31
2018-08-30 11:12:19.208092 IP 192.168.1.5.62017 > 192.0.73.2.443: Flags [P.], seq 698:1060, ack 6660, win 8192, length 362
2018-08-30 11:12:19.208165 IP 192.168.1.5.62017 > 192.0.73.2.443: Flags [P.], seq 1060:1181, ack 6660, win 8192, length 121
2018-08-30 11:12:19.211921 IP 192.168.1.5.62017 > 192.0.73.2.443: Flags [.], ack 6660, win 8192, options [nop,nop,sack 1 {6598:6660}], length 0
2018-08-30 11:12:19.236233 IP 192.168.1.5.62017 > 192.0.73.2.443: Flags [.], ack 6691, win 8191, length 0
2018-08-30 11:12:19.316207 IP 192.168.1.5.62017 > 192.0.73.2.443: Flags [P.], seq 1181:1302, ack 6691, win 8192, length 121
2018-08-30 11:12:19.316276 IP 192.168.1.5.62017 > 192.0.73.2.443: Flags [P.], seq 1302:1401, ack 6691, win 8192, length 99
2018-08-30 11:12:19.316335 IP 192.168.1.5.62017 > 192.0.73.2.443: Flags [P.], seq 1401:1502, ack 6691, win 8192, length 101
2018-08-30 11:12:19.317649 IP 192.168.1.5.62017 > 192.0.73.2.443: Flags [P.], seq 1502:1623, ack 6691, win 8192, length 121
2018-08-30 11:12:19.317692 IP 192.168.1.5.62017 > 192.0.73.2.443: Flags [P.], seq 1623:1745, ack 6691, win 8192, length 122
2018-08-30 11:12:19.326487 IP 192.168.1.5.62017 > 192.0.73.2.443: Flags [P.], seq 1745:1844, ack 6691, win 8192, length 99
2018-08-30 11:12:19.349762 IP 192.168.1.5.62017 > 192.0.73.2.443: Flags [.], seq 667:1181, ack 6691, win 8192, length 514
2018-08-30 11:12:19.368129 IP 192.168.1.5.62017 > 192.0.73.2.443: Flags [.], seq 1181:1745, ack 6691, win 8192, length 564
2018-08-30 11:12:19.368176 IP 192.168.1.5.62017 > 192.0.73.2.443: Flags [.], ack 6978, win 8183, length 0
2018-08-30 11:12:19.368450 IP 192.168.1.5.62017 > 192.0.73.2.443: Flags [.], ack 7139, win 8186, length 0
2018-08-30 11:12:19.388407 IP 192.168.1.5.62017 > 192.0.73.2.443: Flags [.], ack 7333, win 8185, length 0
2018-08-30 11:12:19.388408 IP 192.168.1.5.62017 > 192.0.73.2.443: Flags [.], ack 7463, win 8181, length 0
2018-08-30 11:12:19.388446 IP 192.168.1.5.62017 > 192.0.73.2.443: Flags [.], ack 7598, win 8177, length 0
2018-08-30 11:12:19.388446 IP 192.168.1.5.62017 > 192.0.73.2.443: Flags [.], ack 7792, win 8171, length 0
2018-08-30 11:12:19.388447 IP 192.168.1.5.62017 > 192.0.73.2.443: Flags [.], ack 7915, win 8167, length 0
2018-08-30 11:12:19.388644 IP 192.168.1.5.62017 > 192.0.73.2.443: Flags [.], ack 8122, win 8185, length 0
2018-08-30 11:12:19.790133 IP 192.168.1.5.62012 > 151.101.65.69.443: Flags [P.], seq 1298:1494, ack 50347, win 4096, options [nop,nop,TS val 384789254 ecr 570281090], length 196
2018-08-30 11:12:19.809891 IP 192.168.1.5.62012 > 151.101.65.69.443: Flags [.], ack 50526, win 4090, options [nop,nop,TS val 384789273 ecr 570281290], length 0
2018-08-30 11:12:20.201381 IP 192.168.1.5.62012 > 151.101.65.69.443: Flags [P.], seq 1494:1654, ack 50526, win 4096, options [nop,nop,TS val 384789661 ecr 570281290], length 160
2018-08-30 11:12:20.218586 IP 192.168.1.5.62012 > 151.101.65.69.443: Flags [.], ack 53294, win 4052, options [nop,nop,TS val 384789677 ecr 570281392], length 0
2018-08-30 11:12:20.218586 IP 192.168.1.5.62012 > 151.101.65.69.443: Flags [.], ack 53314, win 4052, options [nop,nop,TS val 384789677 ecr 570281392], length 0
2018-08-30 11:12:20.218645 IP 192.168.1.5.62012 > 151.101.65.69.443: Flags [.], ack 56082, win 3965, options [nop,nop,TS val 384789677 ecr 570281392], length 0
2018-08-30 11:12:20.218646 IP 192.168.1.5.62012 > 151.101.65.69.443: Flags [.], ack 56102, win 3965, options [nop,nop,TS val 384789677 ecr 570281392], length 0
2018-08-30 11:12:20.218736 IP 192.168.1.5.62012 > 151.101.65.69.443: Flags [.], ack 56102, win 4096, options [nop,nop,TS val 384789677 ecr 570281392], length 0
2018-08-30 11:12:20.218847 IP 192.168.1.5.62012 > 151.101.65.69.443: Flags [.], ack 56215, win 4092, options [nop,nop,TS val 384789677 ecr 570281392], length 0
